UserId	Category	Flair	Score	NumComments	Hour	Text
spaceraingame	5	8	10	12	12.0	Government workers of India, what do you love and hate most about your job?
Looking_for_ISPs	5	10	38	47	4.0	How are unskilled Desis getting visas to the 1st world?
MelodicBerries	5	15	13	2	9.0	India’s Terrifying Water Crisis
morlock77	5	1	17	2	8.0	Guys do you recommend books by Audrey Truschke? If yes tell me which.
meinBhiEngineer	5	10	126	14	21.0	TV show, 'Startup ki Baat', will air on DD National
Ash_Sss	5	8	42	8	3.0	16 Million Followers of Indian Instagram Influencers Fake, Study Claims
cartoonpi	5	8	26	3	6.0	How to walk? (In an Indian city) - The post is about Hyderabad but applies equally to all Indian cities.
DoorFeko	5	1	1	0	23.0	[Help] Need to transfer money from Europe to India.How do I do that?
MainBuilder	5	13	115	2	22.0	‘Problem in Chandrayaan-2 rocket, lucky to detect’, say ISRO sources
streanh	5	11	3	5	19.0	Hindi has lowered debate standards in Parliament: Vaiko
ghatroad	5	8	137	17	20.0	Madhya Pradesh Man Gives Wife's Police Uniform To Girlfriend To Loot People
LifeWastedOnLiving	5	1	59	51	1.0	Survey : How many of you guys(men) would fully support your spouse even in cases where they have to relocate to another city or county for few months? Would you be willing to relocate if required even if means starting a new job in the new place.
whatever6999	5	8	1	0	23.0	"AskHistorians question - ""When and where did the Hindu caste system originate""?"
C3tifi3d-D3si	5	1	43	46	2.0	Help! Doctors of Randia
jtglnd	5	1	27	24	4.0	Looking for honest responses
throwaway_009127	5	1	22	9	6.0	I don't know what to do
yellowpowfer	5	1	25	19	5.0	Why Indians, why?
bzanzb	5	2	24	4	5.0	Bigbasket auto renewing bb star membership which is a paid service without customer authorization. Is this legal. There is no way to cancel auto renew or cancel membership through app. Bonus : Their customer support charges 1Rs/min for call
Astro_Break	5	1	22	7	6.0	Can someone please help me with a few questions about CIBIL
ImpressiveCareer	5	1	23	33	5.0	Are electric vehicles really going to provide clean means of transport?
lmkagarwal	5	8	10	1	10.0	17,528 rape cases reported in Odisha in 10 years: Minister
Gavthi_Batman	5	11	198	44	17.0	Adityanath suspends 8 officers for showing negligence in maintaining cattle.
Talldarkn67	5	11	0	13	1.0	"Is India really ""The New China""? Is that a ""good"" thing?"
_siddman_	5	1	17	25	7.0	Can you give me some tips to crack NEET?
pramodc84	5	10	0	0	21.0	High Court quashes CRZ clearance to ₹ 14,000-cr Mumbai road project
peanutbutterasteroid	5	1	76	267	22.0	Women of R/India, what are some things guys think aren't attractive about themselves but actually are?
azi212	5	11	11	1	8.0	Hyderabad police detain Mojo TV's Revathi Pogadadanda
MemoryDealers	5	10	6	4	12.0	Despite a potential 10 year jail sentence, people are buying and selling Bitcoin Cash in India using Bitcoin.com's encrypted platform.
pitchwin	5	11	21	3	4.0	‘Kids being forced to become non-vegetarians’, BJP targets Chhattisgarh govt over eggs in mid-day meals
cvrjk	5	1	12	18	8.0	Is there anything in India that'll give you a quality of life at least somewhat near to those doing an MS in US and working there?
Sarveshns	5	1	24	18	4.0	Do students take CSE just for the package?
ClassicAdvice5	5	8	136	11	18.0	Beaten by Locals While Distributing Bills, Punjab Water Deptartment Official Dies
kkr33	5	13	53	4	0.0	'No Help' No More: How Indian Cops Are Taking Emergency Help to The Next Level
packy21	5	1	8	5	9.0	Where can i buy a Shehnai (at a reasonable price) ?
A3H3	5	1	14	13	6.0	Guys, which is the best bank right now to open a savings account in?
_Floydian	5	1	11	1	8.0	Update of Spotify case with Warner?
toankitprajapati	5	13	57	2	22.0	How One Rajasthan Village Still Has Water Even After A Long, Dry Summer
to_day	5	8	19	3	4.0	Hyundai Kona - the first review of India's 1st electric SUV! - topyups
pazhampori	5	15	14	6	6.0	Mahila Manch: An all-women collective in Ahmedabad is pushing comedy boundaries with their stand-up
MelodicBerries	5	11	50	19	23.0	Yogi Adityanath offers golden crown weighing 2.5 kg to Lord Hanuman
GreatAd8	5	8	110	4	18.0	11 Dead, 26 Lakh Affected As Assam's Flood Nightmare Worsens. As many as 17,000 people have been forced to take refuge in 327 relief camps, and 3,000 villages are underwater because of the floods.
Pb9ZWC2arlBd	5	2	20	5	4.0	iPhone: Apple stops selling iPhone SE, 6, 6Plus, 6sPlus in India
noNSFWcontent	5	8	111	7	18.0	#NewsAlert -- A couple who went to seek protection from Allahabad High Court abducted from the court premises by some people today at gunpoint.
smallaubergine	5	1	18	41	4.0	Suggestions for Indian music that isn't from popular films?
GladDependent	5	11	22	1	2.0	Cycle Rally In South Africa To Celebrate Mahatama Gandhi's Birth Anniversary
goldeneag	5	1	25	2	2.0	Vocational Training during school
MarianneF10	5	8	32	12	0.0	First LGBTI job fair held in India after gay ban lifted
InterestingGolf3	5	8	14	0	4.0	Planning for US Immigration? Indian professionals await good news from the US
vickymal	5	1	13	3	4.0	Any Mumbaikar in US returning soon to India?
_random_error	5	10	95	27	18.0	Why high income tax rates are so unjust in India
OrneryReflection	5	11	28	5	0.0	After LS poll Congress faces financial crisis. Unpaid salaries, cost cutting become norm
insanegenius	5	10	13	0	6.0	Delhi and Bengaluru customs stop clearing 'gifts': Report
wolf_79	5	1	21	12	2.0	I need help regarding my exams
aiyyooooo	5	11	64	13	20.0	Reddy's Andhra Pradesh govt plans to cancel previous green energy contracts
harddisc	5	11	58	4	20.0	Victims Imprisoned, Even as MP Frames Law Against Cow Vigilantism
avgcitizen1	5	11	12	11	5.0	How can I start a Military Hotel??!
harddisc	5	11	16	0	3.0	Find way out to allow judge to continue hearing Babri demolition case even after retirement: SC to UP govt
meemboy	5	1	24	19	1.0	Advice/Tips to avoid Dry Hair/Scalp and get smooth/nourished hair
Dhinnu	5	11	40	26	21.0	UP BJP MLA’s daughter, husband get police cover after attack outside court
vortexxx192	5	1	2	2	13.0	India's meme culture
tchallarox	5	1	19	11	2.0	My First Visa Interview Is nearing Soon
throwawaytraveller9	5	1	3	1	11.0	Need some help with luggage storage
skakat456	5	11	5	1	8.0	As a non-indian I wanted to know is India improving under Narendra modi? Is the economy getting better?
abhispace	5	14	66	5	18.0	Intercontinental Cup 2019: India Show Heart But Lose 2-5 to North Korea
FinalMachiavelli	5	1	4	2	11.0	Need some advice and tips on safety
king_bardock	5	14	12	1	3.0	Old Players I was remembering in this WC 19.
courtysim	5	8	54	1	19.0	7 Army soldiers killed in Himachal building collapse, several feared trapped
jtglnd	5	1	11	5	4.0	Question for research purposes
ssj_cule	5	1	34	92	21.0	People of Randia what expensive things you own apart from electronics and cars?
avinassh	5	8	46	8	19.0	Super Deluxe Movie Review: A Unique, Ambitious, Insanely Detailed, Blessedly Amoral Drama That’s As Epic As It Is Intimate [March, 2019]
GreatAd8	5	8	11	0	5.0	Punjab: Policeman, family lock up another cop; beat him to death over minor scuffle
hronak	5	1	10	6	5.0	Is website development/hosting business still worth doing?
ektimeye	5	11	2247	201	23.0	Jawaharlal Nehru Meeting Albert Einstein At Princeton, USA, 1949
kallu2u	5	1	12	0	4.0	Any SBI employee here ? Wanted to ask about MAB
madamplease	5	11	39	6	19.0	India again abstains at U.N. vote on LGBTQ Independent Expert, draws criticism
kash_if	5	11	7	5	4.0	NIA Bill passes in Lok Sabha, Amit Shah says Modi govt will never misuse law
kkr33	5	8	14	0	1.0	Scores of nurseries flourish in Anantapur
GreatAd8	5	11	19	1	23.0	Bill to remove INC President from Jallianwala Bagh trust introduced in Lok Sabha
GreatAd8	5	8	46	1	18.0	Assam floods: 70% of Kaziranga National Park submerged, animals taken to highlands
kadesi	5	1	36	15	18.0	Anybody interested in reading a few lines of what I write?
harddisc	5	8	18	3	23.0	4 Arrested, 2 Detained After Kerala University Student Stabbed On Campus
wordswithmagic	5	8	73	145	14.0	Train passengers of r/India: What isn't as socially/morally/ethically correct as other passengers think?
harddisc	5	11	19	3	21.0	Karnataka crisis: Resort politics costs crores, but nobody knows who is paying
dawn5	5	1	9	3	3.0	"Is ""Power of Attorney"" property good/safe to buy ?"
wordswithmagic	5	8	46	0	17.0	As Kabir Singh battles brickbats, a look at Malayalam cinema's recent subversion of toxic alpha males
Noob_in_making	5	1	90	53	12.0	"The real life truth behind ""Super 30""."
SaurabhTDK	5	8	9	6	2.0	What should I do in demand draft error?
ClassicAdvice5	5	13	32	22	18.0	American research team including Kerala woman finds cure for HIV
PM-ME-YOUR-FAV-QUOTE	5	1	14	12	22.0	Questions on vaping and getting started
critical_system	5	1	4	5	4.0	Going for passport verification on monday and I have misplaced my 12th marks card.
dorafins	5	11	15	4	21.0	Babri masjid demolition case: Sessions judge seeks more time from Supreme Court to finish case
SPYDER94	5	-1	324	110	4.0	I was searching for something and I stumbled upon my 2nd std papers! 9¾/10 bois, AMA 😂
girl1616	5	1	18	3	19.0	Hey i need a help
avgcitizen1	5	1	3	0	5.0	How do I start a Military Hotel??!
zpw6hgtmx3	5	1	13	2	22.0	Vehicle insurance 3yr renewal qn
thisisatypo	5	1	21	6	18.0	Has anyone of you tried getting Amazon pay cashback through Bookmyshow?
poco_gamer	5	1	14	12	21.0	[AskIndia] Guidance regarding DTU, NSUT & IGDTU
aiyyooooo	5	8	19	0	20.0	In this Kerala restaurant, robot waiters serve food to customers
banker_boy2	5	11	41	11	14.0	Emperors of Extraction: The Mughals did not make India rich. Claims of their welfarism only buttress a political agenda
MentholMind	5	11	447	75	0.0	Largest funeral in recorded human history where over 15 million Tamils thronged the streets of Madras mourning their historic leader, chief minister C.N. Annadurai
judebenny	5	8	4	0	5.0	KETTA KELU | 90's Kids Anthem | Tamil Music Album ft Yuki Praveen |Karthick Gunasekaran |Kevin Steve
Keenobserver1992	5	8	7	1	23.0	Anyone working in OYO Gurgaon Office?
achordiy	5	8	120	1039	7.0	Amazon Prime Day deals : 15th & 16th July
Soccerfreakgod	5	1	16	16	18.0	Travel Help
kingslayerer	5	8	7	1	23.0	Aaja ft. my friend
noxnoctum	5	5	29	29	14.0	What is the name of this snack?
RevenantPanda	5	8	11	0	19.0	Let’s Talk films with Anurag Kashyap and Shyam Benegal
BirdelDander	5	1	1	2	8.0	How can i pay by cryptocurrency in Indian Hotel at 3.00 am?
Symmberry	5	13	12	4	19.0	Apple has stopped selling these four iPhones in India
shiv4121	5	11	3	0	2.0	Yogi Orders Probe Into BJP MLA's Daughter's Marriage Case
AutoModerator	5	12	18	6	17.0	Weekly financial advice thread - July 15, 2019
iphone4Suser	5	8	2241	132	15.0	"[Showerthought] Netflix should provide a ""Skip Song"" Button for Indian movies."
corpuscularcutter	5	1	13	22	19.0	Is UPSC worth it?
oxythebot	5	12	14	65	17.0	Random Daily Discussion Thread - July 15, 2019 at 09:15AM
sudden_dust	5	10	2	0	6.0	Govt readies plan for second wave of asset monetisation
scifikid40000	5	1	17	6	15.0	What will TVS main dealer charge for servicing versus local road side mechanic for Apache RTR 200?
dheerajdeekay	5	10	2	0	23.0	How the Indian government plays stamps and stickers with The Economist | Newslaundry
AtomR	5	8	94	11	5.0	Two Killed, 26 Injured as Pendulum Ride Breaks Down at Ahmedabad Theme Park
kernelslayer	5	1	85	83	5.0	Will India be liveable in the coming years? [Serious]
ppatra	5	-1	123	45	3.0	Chandrayaan-2 launch thread.
ClassicAdvice5	5	14	461	27	19.0	Hima Das wins third gold in less than two weeks
indianjedi	5	8	137	21	1.0	Why everyone should bring paperbags or clothbags with them. (Translation in comments)
fatherofodincj	5	2	16	5	12.0	Need legit men's clothing address
ghatroad	5	9	135	7	23.0	Nugu reservoir in HD Kote, Mysore District
ppatra	5	8	32	2	7.0	RBI to come out with mobile app for currency notes identification
mindlessCoder	5	1	55	92	3.0	Indian ladies, what isn't nearly as attractive as many guys think?
Quantumsparrow_0228	5	11	40	13	5.0	Next Dalai Lama must be chosen within China; India should not intervene: Chinese authorities - The Hindu
aiyyooooo	5	8	294	11	18.0	12-Year-Old Girl Runs Free Library In Kerala's Kochi With Over 2,500 Books. A deep love for books and reading has prompted the girl to set up a library in this Kerala city and lay claim possibly to the title of the 'youngest librarian' in the country.
sudden_dust	5	8	93	9	0.0	After 41-year legal battle, man found not guilty of stealing Rs 20
Memey-McMemeFace	5	8	87	20	0.0	Maharashtra: Woman forces estranged husband to have more kids, court upholds woman's reproductive rights.
Rhymezboy	5	8	53	13	3.0	Zomato refuses to provide any sort of support now because they have provided refunds via credits in the past. [MIC]
mindlessCoder	5	1	41	62	3.0	Guys, what isn't nearly as attractive as many girls think?
Free_Physics	5	15	126	7	21.0	Google Maps adds over 45,000 Indian toilets in 'Loo Review'
Gendrytargarian	5	8	52	1	2.0	Since the 1970's Majuli islander Jadav Payeng has been planting trees in order to save his island. To date he has single handedly planted a forest larger than Central Park NYC.
ThePenguinWhoLived	5	8	1577	126	7.0	stolen from r/wellthatsucks
i_Killed_Reddit	5	11	87	7	23.0	Navjot Singh Sidhu resigns as Punjab minister
radjeep	5	15	198	48	18.0	A female friend is being harassed verbally by some perverts next door. What do we do?
aiyyooooo	5	11	51	0	1.0	Asha Worker Commits Suicide, Alleges Harassment By Andhra Minister. According to a letter purportedly left behind by Lakshmi, she has been subjected to harassment by Minister Perni Nani and his follower M Tulasi.
notaredditor_	5	13	66	4	0.0	Behind the scenes of chandrayaan 2
fallotstetralogy	5	1	11	4	9.0	Where can i sell old computer components locally or online?
MyPetIsCthulhu	5	1	9	15	10.0	Need some insight on making a decision about Kindle purchase?
RevenantPanda	5	14	138	11	19.0	Victorious USA debut for Vijender, clinches 11th consecutive win
thatman303	5	1	69	6	23.0	Hey guys, could you suggest me some good telegram channels to join ?
almostlikeu	5	1	27	15	3.0	Spotify (India version) : How to get rid of this advt. Nothing happens when I tap START TRAIL or DISMISS. Doesn't even go if I try to flick it off.
aiyyooooo	5	8	132	22	18.0	'Bigg Boss' Telugu organisers booked for allegedly demanding sexual favours. A woman journalist alleged that she was offered a spot in the show’s third season in return for sexual favours.
desolationismyfriend	5	11	145	32	17.0	"Rising Intolerance, Hate Crimes Can ""Seriously Damage"" Growth: Adi Godrej"
YourAverageBrownDude	5	8	37	1	1.0	The huge crowd in front of the raths in Puri, Odisha yesterday
spaceturd4	5	8	11	0	7.0	12 Soldiers Stuck In Himachal Building Collapse, Rescue Ops Overnight
SirThighPiece	5	8	29	3	2.0	Found an interesting name in Budapest. Nehru's fault?
abhi1260	5	1	26	14	2.0	Is Prime day 2019 going to be a scam as some people are calling it?
harddisc	5	10	66	3	21.0	India builds 250 homes in Myanmar to assist Rohingya
O_-Zoned	5	8	71	22	20.0	The year 2020
Justikyzer	5	8	94	15	19.0	Bloat the price and sell for massive discount, Prime day sales in general
harddisc	5	11	101	44	18.0	AAP Not Been Able To Provide 1,000 Mohalla Clinics In Delhi As Promised
bhaagmodibhaag	5	8	53	3	21.0	Police Constable Beaten To Death By Mob In Rajasthan
sadbarrett	5	1	36	45	23.0	My dad is retired. How can he best use his free time?
monsoon_man	5	10	4	0	15.0	Railways may buy readymade trains from private players
Dhinnu	5	8	8	1	6.0	Twitter Spat Breaks Out Between Mazumdar-Shaw, Mohandas Pai Over Godrej’s ‘Hate Crime’ Comment
psgcas	5	1	6	0	11.0	Leh - Renting Car with driver
cyberspark15	5	13	13	1	5.0	How to check if you're getting a good deal during a sale on Amazon/Flipkart
ssj_cule	5	12	13	476	5.0	Late Night Random Discussion Thread !
jewels_pecules	5	1	2	15	12.0	How safe is driving a motorbike around Mysuru?
Veettamma	5	8	14	4	3.0	I'm not able to use Jio data voucher
rajutkarsh	5	1	25	66	0.0	Tomorrows the first day of my college life. What things should I keep in mind?
echo_eeco	5	2	140	18	14.0	Allahabad Bank reports ₹1775 core fraud by Bhushan Power & Steel
LiberalCouchPotato	5	1	9	5	5.0	Laptop stores in Kolkata
koibhinhi	5	8	675	43	5.0	Sikh man serving water on the lights from a backpack tank
scribblepoet	5	1	4	8	9.0	Hi. What's the best part of India to visit. I'm American so mountains and less hot weather might be better...not sure if I can handle extreme heat. Thanks
shoo_p-k	5	8	23	15	23.0	Suggestions for buying vacuum cleaner
Famateur	5	11	65	17	18.0	Unnao Police on Madrasa students thrashed allegedly after forced to chant Jai Sri Ram on July 11: According to CCTV footage & probe, those named in FIR weren't there at the spot. Madrasa students had an argument with one of the 4 people in the other group which led to a clash. [@ANINewsUP]
ppatra	5	1	8	2	5.0	Swiggy Super users I need some help!
harddisc	5	13	62	9	18.0	Watch live : Launch of Chandrayan 2 by GSLV MkIII- M1 vehicle
sum1spcl	5	1	40	43	20.0	[AskRandia] has anyone quit their job without any plan? I just want to travel, read and write. Now sure how to make money. [Rant]? Please read inside.
GuyStandingBehindYou	5	1	20	23	0.0	Best smartphones under INR 15000?
RamanySquare	5	9	50	12	18.0	The other side of Bangalore [Nokia 6.1; Tejaswini Nagar, Bangalore]
thegreenhornet19	5	1	10	7	3.0	Is there any job prospect for a MDS ( Dentistry ) in India or the degree is as good as a toilet paper ? What are other options for Dentists other than Practice ? ( Sorry state of Dentistry in India )
pazhampori	5	11	6	0	7.0	Challenging Pragya Thakur: I Did What Digvijay Singh Should Have, But Didn’t
OzFootball	5	8	52	0	18.0	How Hindi cinema is voicing the concerns of the marginalised
charavaka	5	8	13	5	2.0	Bengaluru: African national earned Rs 1,600 for every Rs 10 invested till cops knocked on his door | Bengaluru News - Times of India
Kumaran_Aasaan	5	1	21	10	0.0	[HYGIENE] What's the most effective roll on deodrant stick on the market?
DrAwesome04	5	8	25	41	22.0	Any Under Rated Hindi movies that came and probably went not getting much attention like Karwaan?
harddisc	5	8	50	3	18.0	Police Team Out To Arrest Cow Smuggler Attacked, 7 Officials Injured
IamBlade	5	9	22	2	22.0	Quick snap of the weather in Pune taken from my Moto G plus[4602x2592]
SuchAnnual	5	8	14	6	1.0	The scary truth behind generic drugs in India
Famateur	5	11	21	2	22.0	Navjot Singh Sidhu resigns as Punjab minister
ektimeye	5	8	232	44	9.0	Rabindranath Tagore endorsing Godrej Soap – 1922
igivequalityhugs	5	8	30	5	20.0	This is the place where Roop Kanwar did Sati in 1987. The spot is infront of our house in my village.
ektimeye	5	8	193	36	9.0	Young Amitabh Bachchan with his mother
shazeaa	5	1	34	19	19.0	Why is it so hard to get jobs in Mechanical Engineering?
dheerajdeekay	5	8	20	0	21.0	Microplastics from homes and factories are ending up inside mussels off Chennai’s coast
shayan1232001	5	8	2846	79	19.0	Science students can relate
ClassicAdvice5	5	1	32	32	19.0	My mother received this AltBalaji ad on her Youtube account. She keeps asking, why she receives such inappropriate ads time and again. How should I explain her?
kanchudeep	5	8	49	1	16.0	BBC News: The forgotten Indian inventor who dazzled London
mutantcivil	5	8	10	2	2.0	Mature bag : Level 999 [Meme]
ainy_jaffri	5	1	18	10	22.0	[Question] What do you think about teachers? And schools in general.
Humble-Fool	5	1	10	46	1.0	Laptop recommendation and regarding my old pc and laptop
snicker33	5	2	8	6	2.0	Indian housing lender DHFL warns it may not survive
Doga13	5	1	30	26	18.0	Help, Getting threatening call from scammer
maDkiLzZ	5	1	6	12	4.0	Questions regarding fire tv stick
aiyyooooo	5	11	12	1	1.0	TRS leader abducted by Maoists from Telangana found dead in Chhattisgarh's Sukma; police launch probe
AnExplorerHere	5	8	20	23	21.0	Is there any scientific evidence to support the idea of the Kundalini and the chakra system?
allthingslove	5	1	6	2	2.0	Please help me find USB C to 3.5mm jack for iPad Pro 2018?
imevilx	5	1	5	2	5.0	Punjabi singer
LiberalCouchPotato	5	1	28	42	18.0	Best gaming laptop stores with 70k-100k priced laptops and good offers in Kolkata. Should I use online services instead?
IKA3RUS	5	8	13	10	23.0	Is it possible to transfer money using UPI if I don't have a VPA?
PocketMaar23	5	8	5	3	4.0	How's the state of Spotify India right now?
kash_if	5	11	18	4	20.0	SC dismisses appeals by Kiran Bedi, Centre against Madras HC order curtailing her powers
RevenantPanda	5	14	99	7	10.0	Muhammed Anas broke his own Men’s 400m national record, clocking 45.21s at the at the Kladno Memorial Athletics Meet (Czech Republic) to bag Gold Medal on Saturday and qualified for this September-October’s World Championships in Doha. The entry standard in the event is 45.30s.
grumpoholic	5	1	12	4	22.0	How do I track my transaction using ARN(Acquirer Reference Number)? Is AliExpress trying to cheat me?
RevenantPanda	5	14	23	0	19.0	Meet Sugantham Ramaswamy, Jasprit Bumrah's 74-year-old pace disciple
onmeds1	5	1	21	20	19.0	Update post on break up advice from yesterday
dhruvinpandya	5	1	12	3	22.0	Amazon Prime day sale thread like last year's sale ?
-v_O-	5	1	12	19	22.0	My office colleagues are forcing me to join landmark. Can anyone please advice?
uknowntng	5	8	171	14	7.0	After 41-year legal battle, man found not guilty of stealing Rs 20
adix3	5	11	15	0	20.0	"Azam Khan May Be Named As ""Land Mafia"" On UP Government Website: Official"
RevenantPanda	5	14	19	1	19.0	Junior Shooting World Cup: India begins campaign with two golds
one_brown_jedi	5	11	26	4	16.0	Government to impose penalty for misquoting Aadhaar
kkr33	5	13	8	0	22.0	Chennai School Students To See Chandrayaan 2 Launch From Launch Site
kulikitaka	5	11	9	1	0.0	Goa: Congress MLA who defected to BJP to be new Dy CM
AutoModerator	5	12	25	38	17.0	Weekly mental health support thread - July 14, 2019
hitendra55	5	1	10	4	21.0	Indian youtube prank community
snicker33	5	8	5	0	2.0	Heavy rain and floods in Assam kill at least 10 and displace more than 1 million
sofialora320	5	14	9	0	0.0	Key Players of the finalists' of world cup 2019
kkr33	5	13	8	0	22.0	ISRO TALK | Students talked about Chandrayaan 2 mission
wert420	5	15	3	0	3.0	Law for children abusing their parents
nastynash2k	5	8	8	5	23.0	Is there a AIB Honest Wedding Part 3?
aiyyooooo	5	8	247	37	3.0	Cheated by job agents, 50 Telangana men stranded in Iraq
rustoo	5	11	19	1	17.0	Steve Bannon: As a nationalist, Modi was a Trump before Trump
ernbleek	5	8	15	1	19.0	Kabir Singh is like ...
anonymousguy271103_1	5	8	19	17	17.0	Hi, I have completed my bachelors in Electronics and communication in india.
Odinzai_Iskndar_Khan	5	1	13	6	19.0	What is the feasibility of having Dock-less Bicycle sharing as a public transport in urban centres of India and the Subcontinent in general?
Rhymezboy	5	1	3	3	4.0	What about a weekend thread for movie reviews and discussion?
Niohzxs	5	8	166	9	4.0	Beautiful Graffiti inside marine lines station (Mumbai)
ParmanuMan	5	11	2	0	1.0	BeyondTheHeadlines | Modi and the BJP: Just Follow the Money!
imaginarysquirrels	5	8	138	23	4.0	The Golden age of Journalism is here✨
de_redditor	5	1	8	6	21.0	Helmet suggestions required
fireheart727	5	1	0	12	7.0	Why young Indians (especially teens) make fun of Indians who speak English without the Indian accent or with british/american accent ?
47884375	5	10	21	1	15.0	SBI's Anshula Kant Appointed As Managing Director Of World Bank Group
oxythebot	5	8	15	62	17.0	Random Daily Discussion Thread - July 14, 2019 at 09:15AM
pazhampori	5	15	0	0	7.0	A Girl Named 'No More' Offers a Lesson in Gender Equality
DatBoi2	5	1	4	10	6.0	Best places to live in the NE or South India
adarsh_7	5	1	9	6	18.0	Is anyone going for Dan Mace's meetup in Mumbai ?
Salmon117	5	1	10	8	18.0	Suggestions for good candies/sweets from India?
Stoicpeace	5	8	164	66	2.0	Tamil Nadu is the only Indian state that is expected to see a decline in population in 2041 after reaching its peak in 2031.
the-player-of-games	5	13	22	0	13.0	GSLV Mk.3 rolls out for launch of Indian moon mission
subtopewds609	5	8	659	217	18.0	How many of you are infested by these ads on YouTube?
John-McAfee	5	13	64	3	7.0	TIL iOS 13 shows lyrics in Kannada (and other Indian languages) as well.
happyvirus1235	5	1	46	31	8.0	[AskIndia] Is Herbalife a scam?
ektimeye	5	8	39	9	9.0	Young Shammi Kapoor
makehergiggle	5	8	0	0	5.0	Kolkata | Suggest some NGO/Orphanage near Dakshineswar/Birati/Madhyamgram/Near Airport
KaptaanImmi	5	8	147	60	1.0	Caste lines drawn, Muslim barbers in Moradabad refuse haircuts to Dalits
darkcoderrises	5	8	297	40	21.0	When u need more precision in ur daily Pooja.
azemda	5	11	3	0	20.0	'I don’t f**k fascists’: How politics is shaping the dating lives of Indians on Tinder, Hinge
tirtha2shredder	5	8	7	1	19.0	Need some suggestions for Spiti trip in August [NP]
bs_dhani	5	8	38	10	7.0	Practising Pencil Drawing
ClassicAdvice5	5	8	144	36	0.0	Group of drug addicts in Punjab village contracts AIDS, Hepatitis after using same needle. A group of 16 youths in Punjab has been infected with HCV and AIDS after using the same needle for drug abuse.
deltanick	5	11	61	5	4.0	Ex-BJP MP Dinu Solanki gets life term for murder of RTI activist Amit Jethwa
sageofhades707	5	11	147	106	23.0	Netaji Subhash Chandra Bose cutting off British Empire's head.
MelodicBerries	5	13	7	3	17.0	Are you ready to plug in your Tesla?
Shellynoire	5	-1	0	3	8.0	हरियाणा / अवैध संबंधों में पैदा हुई बेटी, मायके और ससुराल वालों ने रखने से किया मना, प्रेमी ने भी मुंह मोड़ा/ [Woman gets shunned by ex in laws and lover after having a girl from lover]
nahsirk31	5	1	35	25	8.0	Thoughts about the Indian remake? Hopefully, a thread for opinions about the show.
Indianopolice	5	8	7	0	15.0	Mr Mathrubootham on real humilation
