UserId	Category	Flair	Score	NumComments	Hour	Text
pocketrocketsingh	3	11	3	2	20.0	Thank you Anupam Kher!!
counterpoint1	3	8	1	17	20.0	5 things to know about Jhanvi Behal who’s challenged Kanhaiya to debate
thenriforum	3	11	0	19	8.0	Response to all the intolerance deniers in India
dheerajdeekay	3	11	0	14	19.0	A tale of two terrorists - Balasaheb Thackeray and Yakub Memon
indianbsdetector	3	8	2	49	14.0	The 'Captain Secular' cartoon is the most vile and disgusting thing I've seen on this subreddit
LazyAHole	3	8	4	8	6.0	[Rant] [NP] Holi is the stupidest festival
secretlakr	3	8	23	46	3.0	Good comeback. Apply cold water to that burn.
Eranki_srikanth	3	8	0	26	18.0	Feminism is not the evil you think
None	3	-1	0	18	20.0	Height of nautanki - Kejriwal talking to wife through twitter
supermanvonbatman	3	11	2	32	17.0	Fed Up With Bollywood Love Affair With Pakistan Rant
razor5151	3	11	4	69	22.0	Why don't Muslims care about development of the country?
mirror-onthewall	3	11	4	12	19.0	Profile of an AAP supporter on r/india
aiolius	3	8	0	29	3.0	Apparently amazon values my trust at Rs. 2801.
in3po	3	11	3	29	22.0	Mayawati has raised a very valid [p]oint on EVM fraud. indiaevm.org researchers have proved that EVM is vulnerable to fraud and their research paper should be taken seriously. Germany and Netherlands still vote on paper ballots for accountability.
CaptainKulcha	3	11	0	22	4.0	ELI5: Is there concrete evidence available to the public that India launched surgical strikes against Pakistan? Or are we expected to take the Government's word for it?
pratyashi	3	1	0	40	6.0	The artist formerly known as Prince is dead and no one I know cares :(
None	3	1	1	66	18.0	Do we have a moral right over Kashmir?
aadityaksin	3	11	0	1	6.0	How the Hindutva Propaganda Machine Manufactures Lies
IndianLiberal	3	11	2	16	17.0	'Considerable Fear Among Minorities in India': Narayanamurthy
banarasibabu	3	11	0	9	20.0	"Dear voters before you ask for freebies? Read terms and conditions at the bottom. It clearly says ""if modi gives funds"" now fuck-off"
nuclearpowerwalah	3	11	2	13	4.0	safron monkeys are really getting good at it
None	3	8	0	14	16.0	r/India, meet my pet monkey Monika.
lallulal	3	11	0	20	6.0	Modi represents the very rot you vowed to remove from politics when you came out in large numbers at Jantar Mantar.
phelpme2	3	8	0	9	0.0	We'll build bombs, we'll shoot dead Muslims, we'll reclaim India | Hindu Nationalist girls' camp
nuclearpowerwalah	3	11	3	14	2.0	Found a peculiar looking AAP vala
AgonizingHillbilly	3	11	10	16	21.0	Petrol prices in India: Then and Now
aamirguy	3	11	6	31	5.0	Thanks to our government for their interest in cow urine therapy [P]
wanderingmind	3	11	90	239	4.0	I told you so
budtrey999	3	11	1	1	18.0	Modi-style reforms [Satire]
phelpme2	3	11	0	6	7.0	Modi’s US visit was a joke. That's what it was
assholeness	3	8	1	3	19.0	"Climate change remarks by MOST ""intelligent"" Prime Minister of India [NP]"
Ku_Karma	3	8	0	22	17.0	What are your views on this aspect of Eid? Don't you think it results in desensitisation of young, innocent kids?
avatarreddit	3	15	2	13	0.0	"Rohan on Twitter: ""You either die a hero or live long enough to join the BJP"""
randguy89	3	11	0	39	22.0	Why are we so overjoyed that Obama is coming to India? [P]
motherofmyfather	3	11	0	9	22.0	This is how BJP treats its campaign promises
mahaatma	3	11	0	9	22.0	Narendra Modi inciting hatred and violence in the minds of Hindus in Godhra [Video]
AuntyRajniT	3	11	2	10	20.0	How NaMo Lovers view India [Satire]
govindap	3	11	13	28	16.0	Arvind Kejriwal looking pervy AF
War_is_Peace_1984	3	11	23	66	5.0	So i was reading a bit of Nazi history and this struck me. The parallels with the current govt is just frightening.
bollywood_bhakt	3	8	31	147	15.0	Stop bashing bollywood !
thewebdev	3	11	3	3	5.0	Disturbing hate campaign against Rohingyas gets exposed again
None	3	11	2	16	18.0	This happened in the mutton market
s_ex	3	8	4	45	17.0	Filmfare Awards 2016 winners list: Deepika Padukone, Ranveer Singh and Bajirao Mastani sweep away all the awards!
oho_oho	3	1	0	103	2.0	People who oppose beef ban, would you eat a human being ? (more explanation inside, long post)
None	3	11	2	36	2.0	Rant : Have we Democratically elected a totalitarian Regime ? [P]
yogendrasaxena	3	11	0	10	22.0	100 day report card
adwarakanath	3	11	3	15	23.0	RSS strikes again: 'Foreigners' Isaac Newton, Akbar the great to be chucked out of Rajasthan text books
redcopp	3	11	0	9	20.0	For all the BJP supporters on r/india.
CharmingRamsayBolton	3	-1	0	9	16.0	[Captain Secular 2.0] By your powers combined!!!
crusader786	3	11	6	6	0.0	TIL Babu Bajrangi, the Bajrang Dal Leader admitted in a sting video that he and his men killed 91 Muslim men and women at Naroda Patiya. He further said that they raped a pregnant women, slit open her womb, and threw her and the foetus into a fire
mn_g	3	11	64	122	12.0	I think the Pokhran nuclear tests were the biggest foreign policy blunder India ever made. And looks like we are doing it again with Balochistan.
None	3	8	6	26	15.0	Two cricketers: Pervez Rasool, on left, who played for the RCB yesterday; Nayeem Bhatt, on right, who was shot dead by the Indian Army in Kashmir yesterday.
scotyard	3	11	7	13	1.0	To the guy who summed up Modi's aap ki adalat interview, it seems you missed out on the complete picture. Here it is...
hanna2788	3	8	1	22	4.0	My baby's first image
adhaai	3	11	1	8	20.0	Obama, Putin, and Modi went to a bar ...
Anti_bhakt	3	11	0	8	6.0	He's followed by PM Modi, he made fun of Arun Shourie's handicapped son and now he utters pedophile slander against female journalist
MyselfWalrus	3	11	3	11	18.0	Declining exports, few jobs, falling rupee: Is this growth, Jaitley?
NaMoForPM	3	11	2	10	14.0	Here's why this girl is voting for Modi. #IsliyeModi
MyselfWalrus	3	11	10	92	19.0	Man ki baat - The State of the Nation
crozyguy	3	8	20	31	1.0	#Profile For Peace
adwarakanath	3	15	3	19	11.0	TIL the Norwegian neo-nazi, Anders Breivik who shot children, hails RSS and the Hindutva ideology
None	3	11	3	21	3.0	The shifting of blame away from Modi is ridiculous! [P]
MyselfWalrus	3	11	4	5	6.0	Fadnavis lies, nobody buys
MyselfWalrus	3	11	3	28	17.0	"ANI on Twitter: ""NASA has made Sanskrit compulsory,some schools in England also because it causes positive vibrations in brain:S.Swamy"" [Jun 2015]"
Pygnus	3	11	3	9	18.0	"""Indian Assets"" in United Kingdom by Sandeep Adhwaryu"
None	3	11	7	12	20.0	Ok, everybody. Enough of this.
Sykik165	3	11	2	56	18.0	[P] The Cult of Modi - understanding the rise of India-Purusha Narendra
Cow0rker	3	8	0	21	7.0	Designed a logo for Delhi. Should every city get its own logo?
BaidDSB	3	11	0	7	4.0	Today's election results prove one thing: Acche din wont probably come till 2024.
thrownwa	3	11	0	6	10.0	"Modi allowed ISI to function inside Army's camp after Pathankot attack. But he bans NDTV for sharing ""sensitive"" information about the same. Who is Modi fooling?"
bikramksingh	3	11	2	12	23.0	Sanjeev Balyan’s wisdom on Dadri lynching: 1 cow 150 kg, find out who all ate it
avatarreddit	3	11	0	6	21.0	Why Muslims have no problem chanting 'Bharat Mata ki Jai' at Kejriwal's rallies... ...but refuse to when the BJP demands that they do so. The community is well aware that the slogan signifies the Sangh's theocratic vision of India.
SouledMonk	3	8	0	12	20.0	India has the worst Internet audience
rahulthewall	3	11	0	15	23.0	Not far from New Delhi, an army of Hindu extremists is taking shape on the ashes of Muzaffarnagar to take on ‘Islamic terror’ and ‘Muslim terrorists’.
crazydude67	3	11	0	5	2.0	Sri Sri Ravi Shankar on twitter: It is refreshing to know that the rupee will get stronger at Rs.40/- per dollar if Modi comes to power [P] [Old]
None	3	11	0	76	3.0	What if Nepal invades us?[P]
fartullah	3	11	1	10	7.0	why do people conveniently ignore that Kejriwal who's all about anti-corruption is now teaming up with Lalu Orasad Yadav who was convicted for corruption in fodder scam?
_kulchawarrior	3	8	0	8	11.0	Why are Indian girls living in India so bad at giving head?
poor_husband	3	8	1	2	15.0	Sick Sunday Morning NSFW Jokes on Indian Husband-Wife
zrazor	3	11	1	16	20.0	AAP is team 'B' not B-team
assad_syria	3	-1	0	11	23.0	Rape Jihad! Shakti Mills gang-rape accused assaulted 10 women in 6 months
MyselfWalrus	3	11	16	56	6.0	Despite Modi sarkar's tall claims, it's bure din for Indian economy
crazyguy_	3	8	22	141	0.0	/r/India: End the cancer that is Random Daily Discussion threads [PETITION]
cp_redd_it	3	-1	30	50	1.0	Pakis think Hindus behind the Peshawar school attack
Responsbile_Indian	3	11	34	59	6.0	[RANT] I'm sick tired of Mr. Modi's development BS talk in foreign land without much needed reforms on the ground.
anticholinergic	3	8	2	1	19.0	The Accidental Prime Minister director Vijay Gutte’s mother files domestic violence complaint against husband
procast1nator	3	8	0	13	4.0	Bata is a liar.
Desi_Casanova	3	1	0	36	15.0	Isn't Congress's attempt to form Govt. in Karnataka is blatantly against people's mandate ?
Ska8erBoi	3	2	0	19	16.0	Now you know. 100% Cow Dung Cake ( Cow Gobar ) on Amazon.in
avinassh	3	8	2	15	17.0	A Girl On Reddit Opened Up About The Dark Side Of ‘Tradition’ That Haunts Every Indian Girl’s Life
nuclearpowerwalah	3	11	1	3	19.0	The lunatic fringe is now the Hindutva mainstream
Newisnewa	3	11	1	22	19.0	BJP blatantly lied for votes when it promised Delhi statehood in the 2014 elections
MyselfWalrus	3	11	0	8	5.0	Hindu Mahasabha warns of threefold increase in communal violence
aaptard_	3	8	1	8	14.0	Happy Birthday Sonam Kapoor: These cleavage pictures of her are too hot
browndude69	3	11	1	1	5.0	"Omar Abdullah on Twitter: To celebrate the 1st year of the ""good days"" government please enjoy another huge fuel price hike. You are welcome. [P]"
aamirguy	3	11	0	2	17.0	BJP plans propaganda blitz [P]
randguy89	3	11	0	8	19.0	OMG Obama here for Republic Day! Calm down, this is PR not diplomacy - Firstpost
None	3	11	0	15	18.0	Stop complaining about sickulars, its freaking your government now, go and protest there
phnx13	3	11	0	25	4.0	Posting again.how leftist are using books and schools to brain wash children.
None	3	11	1	4	18.0	Swamy: deny Muslims a vote; Giriraj: send Modi critics to Pakistan; Togadia: evict Muslims from Hindu areas; & BJP wonders why there's fear.
ak_47_	3	11	0	3	5.0	Narendra Modi Lies
durachari	3	11	0	63	18.0	Modi authoritarian and a bully, says Ramachandra Guha
None	3	11	0	8	20.0	Modi says India has no War Memorials, here's a quick refresher on India's War Memorials for Mr Bluff Master : Truth Of Gujarat
UnguidedMissile	3	11	11	19	7.0	Oh! whither my India
naive_babes	3	8	11	83	6.0	R/India it's time to take a stronger stance on 377
KarwayLaddu	3	-1	20	71	7.0	#StopIndianTerrorismInPak is trending in top 3 on Twitter in Pakistan
BoOogaBoOoga	3	11	2	5	21.0	BJP IT cell official Sanjay Rathod tweets: Kill JNU students, professors; later deletes it
None	3	11	0	4	9.0	New York Times: India’s Attack on Free Speech [P]
None	3	8	0	158	21.0	I'm a 24 year old single Indian Woman, working in a tier 1 city. AMA
iamdonewiththissshit	3	11	0	79	22.0	Modi - You no longer have my vote next year
mullflix	3	8	0	16	16.0	List of Mosques in various states which were built after demolishing Hindu temples
dheerajdeekay	3	11	3	17	4.0	Right-wing troll followed by PM Modi gives dangerous communal twist to Chennai techie murder, posts graphic images
MyselfWalrus	3	8	2	5	7.0	Clean chit in 4 easy steps
None	3	11	0	1	1.0	Who will save India from these 'Nationals'?
anon_geek	3	11	3	15	22.0	So either India's Commerce Minister does not understand the concept of subsidy or is lying through his teeth. #LiarBJP #DumbBJP #MegaFacePalm
FieryBlake	3	11	0	83	16.0	Whwt do you think of the Sabarimala Temple verdict?
kya_karoon	3	11	4	26	20.0	What happens when Brahminism infects dominate Media
foutrevous	3	11	5	32	7.0	Exactly what is Modiji's IQ? [P]
drspaceman15	3	8	0	98	4.0	TIL Brahmins can be cunts
moadcho	3	11	4	17	20.0	The U-TURNS of Arvind Kejriwal - A COMPLETE COMPILATION.
None	3	-1	36	145	3.0	India's Superhero - Captain Secular
a_ladki	3	11	6	13	1.0	Farmer said ‘will commit suicide,’ Modi’s minister said ‘go do it then’
Sukrachari	3	8	10	113	5.0	Girls of /r/India, would any of you be interested in a no-strings-attached relationship? It can get serious serious if we want it to.
None	3	8	22	74	5.0	Penn Masala has a message for /r/India
MyJones	3	8	23	126	5.0	The problem with the India's daughter documentary
faroti	3	8	0	18	18.0	Apparently Sonam Kapoor feels Appearing in a British band for 2 sec is something she needs to tell to her Grandchildren
rockyy22	3	11	0	6	23.0	Fifth column: Rahul Gandhi has behaved as if a usurper had stolen his birthright
None	3	11	0	1	3.0	Arvind Kejriwal demands PM Modi's educational qualifications be made public
None	3	8	9	1	2.0	Time to outlaw triple talaq in India, says Bharatiya Muslim Mahila Andolan
connectmc	3	14	1	7	17.0	"Rant: Sportspersons are not doing their stuff to ""entertain"" the audience. Someone tell desi commentators/news reporters."
cool_boyy	3	1	0	36	0.0	Randians, Have you accidentally touched any girl/women's boobs? How & what happened then?
ribiy	3	11	1	3	17.0	Did you check facts before making your speech: JNU professor asks Kanhaiya [P]
crazyguy_	3	11	0	2	1.0	Modi govt most anti-intellectual country has seen: Ramachandra Guha [old]
IndianLiberal	3	11	1	13	5.0	Why is Mr. PM pindrop silent on the economy?
annyarun	3	11	1	13	6.0	[P] Why people loose shit when you criticize Modi?
MyselfWalrus	3	11	0	15	4.0	"Ajit Doval warns Pakistan ""You do one more Mumbai, you lose Balochistan"" [Jan 2015]"
None	3	11	3	3	0.0	How do Modi Fans rationalize behaviour meted out to Khemka by BJP govt.
unmole	3	11	1	5	2.0	Amit Shah's arrest prompting BJP to block GST: PM [2011]
Manoos	3	11	1	19	4.0	Modi govt 'promoting Brahmanism' in the name of 'Hindu Rashtravad': Arundhati Roy
None	3	11	0	26	7.0	The thread about India becoming less communal under Modi is hilariously misleading, and here's why.
--TeraBaap--2	3	8	0	10	11.0	After Cow Urine Fighting Cancer, Now RSS Says Cow Poop Can Make Nuclear Bombs Ineffective
pakaomat	3	11	1	19	21.0	MODI's 15 month period had been second worst for sensex when compared with other prime ministers since Indira Gandhi.
thepinkbox1	3	1	0	13	1.0	[seriious] need advice, should i quit my high paying job (7 figures) or am I making a mistake?
vishalrix	3	11	0	24	15.0	First Teesta Setalvad, and now Sanjeev Bhatt. The downfall and legal troubles of modi's worst critics is not a coincidence.
altmanfromrandia	3	1	0	26	12.0	Why do NRI girls ( girls who were brought up, educated outside India) seem hotter than an average Indian girl?
unmole	3	11	0	6	7.0	Hindutva and Fascism Compared
Machoo_PurO	3	7	0	29	11.0	Spot the Difference
killm	3	8	0	11	7.0	Can We Trust Adani with the Great Barrier Reef? | Great Barrier Reef | GetUp! Australia
MyJones	3	8	2	31	7.0	India's daughter : chickens come home to roost
desi_ninja	3	8	0	2	2.0	Kohli and Sir at Pride Rock
chap_chap1	3	11	1	21	22.0	This is how BJP is radicalizing Indians at every street corner
None	3	11	2	26	8.0	"If Modi's campaign is only about development, why is there so much use of saffron color at his rallies and on his clothes? Is it only ""appeasement"" if you are appealing to Muslims?"
patriots_unite	3	11	2	18	7.0	A simple, no-BS response to The Economist's criticism of Modi.
unmole	3	11	0	9	4.0	BJP and AAP supporters, Walking Dead style
None	3	8	15	66	21.0	(Rant) Fuck Christ University.
panda_zen	3	11	16	51	10.0	The disintegration of India: what do you think?
CharmingRamsayBolton	3	11	19	56	6.0	Its just an election. Get over it.
MyselfWalrus	3	11	10	11	3.0	Scavenging, a spiritual experience for Dalits: Modi [Nov 2007]
Abki_Bar_Modi_Sarkar	3	11	8	16	18.0	‘RSS was silent during the 1984 riots. At places, it was implicated in the violence’ [p]
captainjacksparrow3	3	8	12	6	15.0	Taimur after 30 years.
reva_r	3	8	14	79	2.0	The character Kabir Singh objectifies women, the movie doesn't.
BasedAssadReturns	3	11	0	6	10.0	Thank you Modi, for proving that partition saved the subcontinent’s Muslims from extinction [NP]
Chacha-Choudhry	3	11	0	7	13.0	'Dear PM, You Bend Laws To Favour Others,' Tweets Furious Arvind Kejriwal.
MyselfWalrus	3	11	0	7	6.0	CRPF men brutalise family, attempt to rape and kill
arushikap	3	8	0	6	0.0	Women Should Not Go to Dargahs as the Dead Can See Women Naked, Says a Nizamuddin Dargah Maulvi
agentbigman	3	11	1	14	22.0	Now, a Narendra Modi film before every movie in the theatre
japanorway	3	11	1	1	19.0	Kejriwal's house has 30 air conditioners, June’s bill was Rs 1.35 lakh [p] [old]
MrJekyll	3	11	0	3	22.0	Nostradamus Predicted Modi Rule, Minister Posts On Facebook
None	3	11	0	11	6.0	'Is taking pictures also wrong now?' Kanhaiya Kumar on his photo with a fellow student A hamhanded attempt to portray the student leader in a supposedly 'compromising position' misfires.
badbola	3	11	0	0	5.0	`Bhaiya, I am not from the RSS`: Top 10 quotes by Rahul in Parliament
modiusoperandi	3	11	0	0	20.0	Woman files 1st rape complaint in Murthal incident
avatarreddit	3	11	0	5	21.0	Zee News is unhappy with British journalists being, umm, journalists. Reacting to The Guardian and BBC’s tough line of questioning at the press conference yesterday.
littleboy43	3	11	0	9	23.0	Why Apple CEO Tim Cook has good reason to turn down Modi's invite to visit India [P]
hummusporotta	3	11	0	4	22.0	[P] Six Outrageous Things BJP Leaders Have Said About Dadri Murder Over Beef
BornAndRaisedInIndia	3	1	0	28	17.0	Hello r/India. Why are most randians upper middleclass/rich peeps? And why are you so civil?
None	3	11	0	7	6.0	India have committed international suicide by banning film: Udwin
None	3	11	0	0	6.0	Ban of rape documentary in India is shameful
None	3	11	0	4	20.0	If you wish to be a success in the world, promise everything, deliver nothing : Napoleon Bonaparte
homosa_piens	3	15	0	4	21.0	What explains the BJP’s U-turn on the issue of removing Article 370? [r]
NarendraKejriwal	3	11	0	0	7.0	Opposition Reaches Delhi Assembly
pokekejru	3	11	0	0	6.0	This one chart shows why the BJP cannot lecture AAP on political funding[P]
bajrangi_bhaijaan	3	11	0	2	18.0	How people see kejriwal
IndianBureaucrat	3	11	0	13	19.0	"Subramanium Swamy: Indian Brahmins and learned persons never had any posts, yet Rajas listened to them. If I say anything on any matter, the Raja listens to me. I am in that good position today."""
NaMoForPM	3	11	0	15	1.0	Mr.Kejriwal himself is in contact with a senior Congress leader,he must give an answer : Sandeep Dikshit,Congress
Daemanax2	3	11	0	22	1.0	"The hypocrisy of my friends ""eid mubarak"" wish, and of others like him"
None	3	8	0	10	13.0	How to become a Hindu nationalist in 10 easy steps
None	3	8	0	12	9.0	Why I don't like Muslims
sanskarimata	3	8	0	26	1.0	"So did ""good guy"" Imran Khan vote?"
nautankibaazi	3	11	0	26	19.0	A humble question to BJP supporters.
Lowpostdefence	3	11	1	2	15.0	'Delhi went through a nightmare for 49 days under Kejriwal' - Madhu Kishwar
SlasherPunk	3	11	2	8	4.0	Fuck da constitution
whoreyfucks	3	8	30	41	17.0	[NP] For Guy Virgins: Basic Things No One Told Me About Sex
badbola	3	11	4	2	18.0	India’s Extremists Turn on Left-Wing College Kids
nuclearpowerwalah	3	11	5	13	8.0	Devotional circle head fisting
the_php_coder	3	11	0	26	18.0	[Honest Opinion] From Ravish to Dhruv Rathee to Kanhaiya, everyone hates Modi but nobody has anything to offer what the people of this country really want
kogami-shinya	3	8	4	10	3.0	Kerala Model.
hyuku	3	1	4	179	16.0	[AskIndia] Why do you care about privacy?
None	3	11	0	13	22.0	UP's population is mostly illiterate and uneducated...
-0-1-	3	11	0	13	21.0	Old habits of Indian National Congress and team
serialposter	3	13	2	15	18.0	Is it finally happening?
daddy_in_distress	3	8	0	40	8.0	My 17 year old daughter is flirting with 5 guys right now; and I am worried.
None	3	11	3	14	5.0	Sonia should go to Italy to solve the Italian marine issue #SendSoniaToItaly [P]
iwillwinsomeday	3	8	0	17	9.0	#BreakingStereotypes
TenBlueBirds	3	8	2	4	13.0	Why Are Hindus Attacking Muslims In India?
BurkhaDuttSays	3	15	2	37	18.0	Next time British Origin John Oliver talks about India's issues, I just request him to answer to Shashi Tharoor's Oxford Union speech, which Shashi won. [Request]
amlu_india	3	8	0	8	2.0	Caption This !!
woah--dude	3	8	1	13	20.0	[NP] India's best actor with Amitabh Bachhan
ubfact	3	8	2	45	9.0	Amazing Facts Of INDIA
None	3	8	2	12	4.0	Best Places to Have Beef in Delhi
popat2000	3	11	15	4	15.0	Had AAP and Congress done well this elections...
None	3	11	5	8	5.0	This is India, be like India! [P]
spez666	3	8	3	13	5.0	[Shower thought] If someone calls me from their Jio number, I automatically assume they are freeloaders and have nothing going on in their life.
narayananh	3	8	4	6	18.0	The big fat Italian robbery – this young Indian couple were robbed in Italy, and their story will leave you speechless!
None	3	11	2	6	17.0	After Karnataka, 2 Gujarat BJP MLAs caught watching porn in House; BJP cries conspiracy [old]
manjuhere	3	8	1	21	21.0	Tanzanian girl's incident in Bangalore is just Mob violence. Nothing to do with sexual/racial assault.
amlu_india	3	11	4	16	22.0	Dear Sagarika, what happened to a happy family all of sudden ?
redditsudo	3	11	0	45	3.0	I'd vote for BJP in 2019
frustrated_indian17	3	13	4	18	17.0	This Bitcoin fad is just like start-up fad in India, bored people trying to find a way to make life exciting!
Diedalonglongtimeago	3	8	3	44	0.0	I Get So Annoyed When 'Cool' Young Women Say They Are Not Feminists: Arundhati Roy [NP]
heatseeker47	3	11	4	62	20.0	Kanhaiya Kumar Says BJP Supporter Tried To Strangle Him On Plane
an8hu	3	11	3	47	0.0	Why is r/india full of casteist people?
None	3	11	5	7	11.0	Achche din aa gaye mitron (Good days are here, friends)
lallulal	3	11	0	20	6.0	CAG found irregularities of Rs.27,672 crores in various depts of Guj govt from 2002-11. So much for Modi's good governance!
DopingExpress	3	11	4	35	9.0	A site that lists out scams by the BJP
MainHuDoga	3	11	0	17	18.0	[P] Satellite pic of India during Holi released by baba ramdev. So prod!
DesiGif	3	8	40	117	15.0	When I argue with my South Indian friend
Alex_Smart	3	11	22	135	3.0	The difference between AAP and BJP
BalakwithVISON2020	3	7	10	19	21.0	Baba Ramdev's Patanjali launched healthy MAGGI, it claims no LEAD & its made of Aata and fiber...
IndianDude-51	3	8	12	111	17.0	Do you want to know how westerners perceive India? Just watch this video.
nocturnal_shit	3	8	10	29	10.0	Never will I ever see this kind of sky in India.
desolationismyfriend	3	11	0	6	21.0	How BJP Supporters Turned A Fight Over Parking Into A ‘Terror Attack
Gavthi_Batman	3	8	0	15	1.0	Don’t malign Savarkar for petty political gains.
None	3	11	0	7	1.0	When you smell Kerala Beef Curry and suddenly realise you're representing BJP!
wanderingmind	3	11	0	4	17.0	By negotiating with Raj Thackeray, the BJP government has diminished itself | columns
None	3	5	0	18	6.0	delicious home made cow steak in a state where it is illegal (details in comments)
modiusoperandi	3	11	1	2	2.0	After Praising Nehru On Facebook, IAS Officer Is Transferred
notautobot	3	8	1	2	10.0	Another Nirbhaya! In A Horrific Attack Kerala Woman Raped And Murdered, Private Parts Mutilated
hypocritesrule	3	8	0	8	22.0	ATS forced me to implicate Lt Col Purohit: Samjhauta blast case witness
kgbkg	3	8	1	14	21.0	Why do some people mock initiative like Mann Ki Baat?
abhi16	3	11	0	11	11.0	WORLD'S GREATEST LEADERS: Arvind Kejriwal
King_podrick	3	11	0	0	20.0	Dhoni’s Facebook wall on the eve of the match against Pakistan
crazydude67	3	11	0	3	22.0	Narendra Modi slams PM for 'having chicken with Pak PM as our soldiers were being killed' [P][Old]
None	3	11	0	26	8.0	Sentiments of a *numerical *minority .Please stop talking.Emotional Post.
srkguy3	3	11	1	14	4.0	Modi govt's achievements in 1 year
500aan	3	11	0	11	7.0	Hindu Mahasabha leader calls for forced sterilisation of Muslims, Christians to restrict growing population
chap_chap2	3	11	1	5	8.0	TIL , Post 2002 riots , Modi called relief camps 'child-producing factories'
None	3	8	0	3	3.0	Wondering how will she react now ?
DoubleMasala	3	8	1	12	15.0	TIL the young Muslim boys who had stood at the gate of Naroda Patiya to defend their locality by preventing the mob from entering through the only gate of Naroda Patiya were shot and killed by the police facilitating the entry inside the Naroda Patiya and thereby killing around 100 Muslims
sanskarimata	3	11	0	2	16.0	BJP candidates list shows that it loves dynastic politics too
The_Dreaming_Guy	3	15	0	13	22.0	Modi - No [R]iots in Gujarat in last 10 years [Fact Check --> Modi is Lying]
None	3	11	33	23	15.0	[P] BJP MP ‘creates ruckus’ at Bhopal airport over being allotted AI economy class seat
sudden_dust	3	11	6	8	15.0	Exit after polls.
None	3	8	5	48	2.0	[Help]Right To Eat Human Meat : A new legislation is needed .
None	3	11	4	21	20.0	Regarding the ongoing Kejru dramabaaz
raghavkapur1999	3	11	9	34	21.0	We don't deserve freedom and democracy
TheGhostOfAdamSmith	3	11	62	211	20.0	Kejriwal is a cynical piece of shit [P]
dodunichaar	3	11	21	86	6.0	Big embarrassment! PM Modi walks as National Anthem being played in Russia
doc_two_thirty	3	15	18	17	18.0	The latest blockbuster [R]
chandu6234	3	11	15	153	7.0	Where is this country heading?
chawklates	3	1	11	103	23.0	I'm Hiring: Looking for a young quirky female product manager for a well funded social app.
ThrowAwayGilgamesh	3	11	4	8	5.0	Modi Government Prevents Journalist Rana Ayyub From Speaking at Doha Event
smartass39	3	11	6	4	16.0	FDI in retail: BJP to stall Parliament today [Old] [P]
CeorgeGlooney	3	11	5	76	2.0	If RSS is such a great nationalist organization...
_kulchawarrior	3	8	0	15	6.0	Sporty hotness
menderu	3	11	4	46	6.0	Does this subreddit lean far too right?
dhamakaprasad	3	11	5	42	5.0	High drama at AAP govt's protest: Traffic jams & closed metro stations cause public inconvenience. [P]
