UserId	Category	Flair	Score	NumComments	Hour	Text
TheBeginnerr	1	15	19708	838	1.0	Will donate thrice the number of upvotes (amount in Rs.) i get for this thread in next 24 hours
spikyraccoon	1	16	18247	1503	2.0	Indian reply to NYtimes cartoon on Paris climate accord by Satish Acharya.
GlanirBhavti	1	16	18198	960	18.0	The essence of the Indian soap opera, distilled into one GIF.
hd-86	1	16	11262	343	2.0	Tragedy of India
Whatay	1	8	10771	382	0.0	If you are not moved by this picture, I wish I had your heart. [NP]
doc_two_thirty	1	15	10192	6988	20.0	Megathread: India-Pakistan border skirmish
AudraMagnus	1	8	8983	232	17.0	Image Of Smiling Baby For Hyderabad Police Officers Who Rescued Him From The Kidnappers Thrill The Internet
Lowcrbnaman	1	11	8869	315	17.0	This is India.
cetrog	1	11	8730	459	18.0	No Yoga and Yoga. Difference
ironypatrol	1	16	8516	218	19.0	Winner of a fancy dress competition at a school in Bangalore
UnileverCancerFactor	1	15	8052	257	19.0	Help, ideas needed. HLL poisoned my village with mercury. There have been 250 cancer deaths in just 5 years in just my tiny village. Se[r]ious replies only.
None	1	8	7963	234	18.0	An Indian woman, a Japanese woman, and a Syrian woman, all training to be doctors at Women’s Medical College of Philadelphia. - October 10, 1885.
Lowcrbnaman	1	8	7121	484	18.0	Incredible India.
ForPranitaThrowaway	1	15	6555	241	18.0	My friend passed away and TOI made a mockery of her.
thesaket	1	8	5779	114	19.0	Memes work a bit differently when in Delhi!
wordswithmagic	1	8	5731	322	23.0	Hindu cop standing guard as Muslim comrade offers namaz (photo shared by Srinagar Sector CRPF on Twitter)
Avinash_Sharma	1	8	5614	162	17.0	Tigress Samruddhi with her four cubs at the Aurangabad zoo. The cubs, including two white, were born on Saturday morning.
notsocourageous	1	-1	5593	248	0.0	500TB pen drive from Mahabharata era unearthed by Archaeological Survey of India
OneWhoShouldBeNamed	1	8	5588	384	16.0	Dem truth bombs
Arkn0id	1	8	5519	177	23.0	My father has been taking the same bus to work and back for the last 5 years. Today, all the regular commuters gave a farewell to the bus conductor on his last working day.
SanskariNari	1	8	5232	283	23.0	Indian Wonder Woman- Cosplay by Deepica Mutyala
Phuc-Dat_Bich	1	8	5199	289	23.0	If you still throw garbage on street.
UUUU__UUUU	1	11	5183	306	17.0	#Profile4Peace #SayNoToWar (x-post from /r/pics)
coutinho_magic	1	8	5020	168	16.0	Good bois celebrating International Yoga day!
Lowcrbnaman	1	8	4951	148	18.0	Celebrating holi amidst snowfall in Sangla, Himachal Pradesh.
junglewahibanaenge	1	2	4926	315	5.0	A mother wrote to Hindustan pencils about her left-handed daughter's needs and they responded
Fraction25	1	8	4802	264	8.0	The Trend is spreading to Dimapur, Nagaland.
madamplease	1	11	4686	562	19.0	Gay sex has been decriminalised in India. The Supreme Court struck down Section 377 of IPC. Love wins.
AkshayJoshiFilms	1	8	4639	177	17.0	Beautiful Bangalore
wazbir	1	8	4561	221	17.0	Tesla Semi Truck in India. [NP]
SharkThug	1	11	4442	308	18.0	Everything is Banned: An Ajnabee's Reaction to the Porn Ban
Keerikkadan91	1	8	4438	141	13.0	This is Ramesh from Dharmapuri, He donated 5 baskets of guava when he saw the collection drive in Bangalore. This was everything he was planning to sell this evening. [x-post r/Kerala]
umanghome	1	8	4422	148	18.0	I finally decided to upload my first webcomic [OC]
pink_vanilla_skies	1	8	4425	315	15.0	Spotify after two songs
Jugal0707	1	8	4417	261	2.0	India did it before it was cool.
Parsainama	1	11	4391	1390	16.0	IAF Sources: 12 Mirage 2000 jets took part in the operation that dropped 1000 Kg bombs on terror camps across LOC, completely destroying it
prabot	1	-1	4347	619	7.0	India's first indigenous processor developed at IIT Bombay. I am a designer AMA!!
sudhanshu_sharma	1	11	4233	215	14.0	My mood since past few days.
OneMillionFireFlies	1	11	4234	108	21.0	Better Safe Than Sorry
buggywhip69	1	8	4154	557	22.0	Unpopular Opinion: Divorce rate in India is less because most women are not financially independent.
ragafundoo	1	8	4141	244	0.0	Bought a book from Daryaganj for a 70 bucks. Opened it up later to receive this little surprise!!!
RevenantPanda	1	14	4141	77	17.0	Indian Women’s Hockey team returns to India after winning the FIH Women's Series Finals Hiroshima 2019 after defeating host Japan 3-1 in the Final on June 23
UndeniableDork	1	13	4130	323	22.0	India's Bharti Research Centre in Antarctica.
Keerikkadan91	1	16	4100	417	21.0	Shilpa Shetty's thoughts on Orwell's 'Animal Farm'
xarteztx	1	8	4092	134	14.0	"I painted my uncle yesterday. I'm on my trip here in Punjab and have been trying to create this for years now. Oil in sketchbook, ""Darshan"""
yothisisyo	1	15	4003	166	16.0	Why are you running, you asked for it ?
NormieRey619	1	8	3970	182	5.0	A young poor kid offering a part of her meager meal to an elderly dog. I took this photo in one of the biggest temples in West Bengal. In the entire temple, this scene was the one of true devotion.
hipporama	1	8	3970	188	18.0	Somewhere in Assam
Your_Dreamer	1	11	3970	713	21.0	[P] what the fuck are we doing? the government have banned Porn, Reddit, Pub-G, even live leak & many more website! we should immediately take action now
RVXIII	1	8	3892	78	17.0	From the Horse's mouth
VyomK3	1	15	3880	472	2.0	Moments after a plane landed, 10 min before gates would be opened
toankitprajapati	1	9	3864	124	19.0	Inside Mysore Palace. [1080*1168] [OC] [Redmi Y2]
None	1	8	3861	105	23.0	Great idea sirji!!
The_DarkMatter	1	11	3834	109	17.0	Heartbreaking photograph. Indian Army officer consoling father of Lance Naik Nazir Ahmad of Kulgam in South Kashmir who sacrificed his life for the country while fighting terrorists recently. India salutes these sons of the soil in Kashmir who always put nation first. Prayers
grtfrnds	1	13	3816	202	4.0	A role model for countless Indian women, Kalpana was an ordinary girl from Karnal whose lofty dreams and indomitable courage took her to space.
boredmonk	1	8	3792	210	18.0	Someone made a stormtrooper Ganesha.
None	1	8	3766	111	15.0	Don't call me to your wedding if your bridesmaids aren't dressed like this.
None	1	8	3726	336	19.0	Indian men line-up for a free meal on the occasion of Id-Ul-Fitr near Jama Mazjid, New Delhi. Most of these men are rickshaw-pullers, daily-wage laborers and homeless men who rarely get two square meals a day
veekayz	1	8	3721	310	0.0	Just another street in Hyderabad
ironypatrol	1	8	3695	263	18.0	ToI delivers for a change
noNSFWcontent	1	8	3696	153	18.0	Mom found this good boye outside a store in 40 degrees heat.
arvindred1	1	8	3693	165	17.0	Three businesses, one frame.
Allegedly_Stupid	1	8	3698	140	20.0	Govinda Govinda
prawncream	1	8	3673	252	20.0	Harsh reality is we're it
gaganaut	1	8	3653	173	6.0	A dog wearing sunglasses hitchhiking atop a rickshaw in Mumbai, India
reva_r	1	8	3636	140	6.0	Mumbai man cleans 5 million kgs of trash in 96 weeks. [X-post r/pics].
IndianRoyal	1	14	3631	108	18.0	Indians Right Now.
TanmoyKayesen	1	8	3630	258	19.0	Here to share my ballpoint pen drawing with my fellow Indians.
shyamex	1	9	3598	173	15.0	Jatayupara, Jatayu Earth Center, Kollam, Kerala [x-post r/pics]
boredmonk	1	14	3543	158	15.0	Swapna Burman, 6 toes in both legs, no money for special shoes. Father a rickshaw puller, mother working in a tea garden, running for her country in the final event of the Heptathlon with a bandaged jaw. And winning it for India This country certainly has no shortage of heroines
squidly_doo	1	8	3498	141	17.0	I lost a night's sleep driving and camping out here but when the sun rose, this view made it all worth it. Nandi Hills in Karnataka. [NP]
SanskariNari	1	8	3492	421	21.0	Grocery shopping list of an Indian wife
nrkivar	1	8	3495	284	16.0	How to get more volunteers for 'The ugly Indians' cleanup campaign? Below was result of 3 hour and 15 volunteers
kash_if	1	8	3398	131	17.0	Andhra Pradesh should redesign this map/logo
ovnandan	1	8	3287	139	6.0	#trashtag India. Cleaning up the local Ganges riverbank in our small town of Uttarpara, West Bengal.
SharkThug	1	8	3278	207	3.0	Actual footage of people trying to prebook Avengers: Endgame on BookMyShow since yesterday
sayn23	1	8	3208	418	16.0	I stuffed most of Europe inside India
Ravana13	1	8	3200	117	17.0	Me at Kerala
Ganjaalex	1	8	3193	113	20.0	A misty morning in Idukki,Kerala.
None	1	11	3159	115	20.0	The hero we need but don't deserve. Bharat Bhushan Gupta Aadhar breach whistleblower.
iknowamitshah	1	-1	3162	400	3.0	One Inch: The difference between WC final and Billion heartbreaks
FactCheckPolice	1	13	3155	174	15.0	Indian farmer builds lean mean TREE CLIMBING machine!
Saigo_Digiart	1	8	3129	205	8.0	I thought there was a lack of India based satire comics, so I made my own! - Brown Paper Bag. Let me know what you guys think about a few of my first comics
None	1	8	3049	150	13.0	Found at a hospital in India.
None	1	8	3043	85	16.0	An in depth news coverage of the monsoons
gnawledger	1	11	3033	185	17.0	Every home today morning
TittyMcTwister	1	8	3034	87	20.0	#satisfying
almostparallel76	1	15	3029	174	8.0	Need all the help possible.
Ravana13	1	8	3018	99	19.0	Pic From Rural Kerala
xtermist	1	9	3007	126	16.0	Just a photo of HP Petrol Pump I took recently. The line drawing is added in PS later. [OC] 3922x4902
itsmuks	1	11	2996	429	16.0	The Times Of Modi!
eshwarudu	1	8	2998	169	18.0	The Original 10-Year Challenge
dezwqX_0001	1	8	2988	175	7.0	Something I made given the time _/\_
randombharti	1	11	2980	194	19.0	Find someone who looks at you the way Putin looks at Modi
noNSFWcontent	1	8	2966	100	20.0	Bengaluru City Police
aiyyooooo	1	11	2969	199	19.0	A Big Lake in Chennai - 2018 vs. 2019
xarteztx	1	8	2952	111	4.0	Hi r/India! I wanted to share this piece I finished this morning of my granduncle in Punjab
RevenantPanda	1	14	2936	63	9.0	Congratulations to the Indian Women's Rugby Team who have scripted history by registering their First-Ever International 15s Victory by beating Singapore in the Asia Rugby Women's Championship Division 1
jatadharius	1	9	2930	148	20.0	Not a glitch in the photo, Jama Masjid, Ahmedabad
bs_dhani	1	11	2925	226	15.0	Today is 26/11
yal_sik	1	10	2914	1738	4.0	Modi: From Nov 8 to abolish 500 and 1000 Rupee notes.
None	1	15	2912	340	17.0	A man confronts the cops harassing a couple in a park. Much respect! We need more folks like him.
None	1	8	2906	155	19.0	Powai, Mumbai - The great divide
insane_issac	1	8	2895	156	0.0	[OC] I painted a mural.
anubhavmajumder	1	8	2888	207	5.0	Every single time!
kashyap07	1	8	2870	94	17.0	Something wholesome I came across this morning in Bangalore
_why_so_sirious_	1	11	2845	535	23.0	Dera Sacha Sauda chief Gurmeet Ram Rahim found guilty of rape, taken into judicial custody
shayan1232001	1	8	2846	79	19.0	Science students can relate
iluvalbundy	1	8	2839	127	8.0	Vegetable market in Sikkim
sir_qoala	1	11	2837	95	17.0	Catch it before it’s too late.
Tatsat_Bh	1	8	2835	173	17.0	Domestic Dog saves the lives of 30 People in UP
Stuge234	1	9	2828	114	19.0	"India Gate ( Arc-de-Triomphe"" like archway in the middle of a crossroad)- New Delhi It took 3 attempts to realise this picture - Nikon D700 | 800 x 501"
None	1	15	2826	176	16.0	Rivalry at its classiest
chariboi	1	14	2829	131	17.0	Sunil Chhetri (Charcoal art) made in our uni
mafail	1	8	2824	103	17.0	IISC Banglore
limitlessabhi	1	11	2814	379	18.0	Countries with smaller population than Uttar Pradesh.
RVXIII	1	8	2805	119	8.0	Even when the Avengers are in trouble & no matter where they are, our Sikh bros will be ready to serve the Langar.
4everaBau5	1	8	2801	179	16.0	Indian albino family
SPYDER94	1	5	2780	453	3.0	Tis the season, people :D
achoooooooooooooo	1	8	2766	395	19.0	When you're promoting a patriotic movie but someone asks to show your passport
erazzers	1	9	2757	152	21.0	Captured this just before sunrise near Bhimavaram on my way to Vizag by train.
ThatRedScooter	1	8	2753	221	19.0	Its my Rajapalayam's 10th birthday! Hes the best dog ever. Wish more people here knew about this nearly-extinct breed rather than importing Huskies and torturing them in the scorching Indian summers!
maimpetal	1	9	2751	148	4.0	[OC] Although mumbai rains are disruptive, they do bring beautiful scenery and holidays.
Lowcrbnaman	1	9	2748	173	18.0	Indian Ascetic during Kumbh Mela.
Abhi_714	1	8	2746	124	0.0	Getting in on the Selfie craze [P]
rrao115	1	8	2738	98	19.0	A coconut vendor celebrating Deepavali in Bengaluru !!
OnePunchSenpai	1	8	2713	142	19.0	A member of indian army services corps at Dunkirk, 1940.
Saigo_Digiart	1	-1	2698	174	0.0	/r/India is one of the biggest reasons for where Brown Paperbag is at now. Here are some of my latest comics directly hosted on imgur for all those without a Facebook or Instagram account
RVXIII	1	11	2699	168	3.0	#Justice for Asifa # Beti Bachao
narayananh	1	2	2685	206	18.0	Please give this guy his ₹2
darudedudedocta	1	8	2681	111	3.0	When you lose your ball ..you improvise..this happens only in India?!?!
chinztor	1	8	2677	174	15.0	Print media finally standing up against social media.
kash_if	1	10	2680	120	16.0	Lone Aadhaar dissenter wins a point
The_DarkMatter	1	8	2671	62	17.0	Konark Wheel sculpted by Sudarsan Pattnaik at International Sand Art Exhibition
sxx0x	1	8	2655	169	4.0	Finishing his homework.
ghost7807	1	2	2663	143	19.0	Creativity Level - Blue
reva_r	1	8	2654	90	4.0	Anyone can win IPL but...
pammoth	1	8	2660	170	17.0	Sprinter Dutee Chand says she’s in same-sex relationship with soulmate. Dutee Chand, the 100 m record holder and winner of two silver medals at the 2018 Asian Games, is the first Indian sports star to acknowledge being in a same-sex relationship.
fazilonweb	1	11	2638	161	16.0	This is an important message for the people of India right now. The image is a graffiti art, I added colors on side to resemble India's flag.
None	1	10	2629	233	8.0	The new 20 rupee note! Clear inspiration from Mango Bite.
Lowcrbnaman	1	8	2635	205	16.0	This is Shakuntala Devi aka the human calculator. We all might have heard about her but a lesser known fact is that she was also the author of first Indian book on homosexuality titled ' The World of Homosexuals.'
iNotRobot	1	11	2618	212	3.0	Burj Khalifa marks India’s 68th Republic Day with a spectacular LED illumination of our National flag
RevenantPanda	1	14	2605	89	16.0	Dutee Chand won the Gold Medal in Women's 100m sprint at the 30th Summer University Games in Naples (Italy) on Tuesday. This is the first time an Indian has won a 100m Gold at this global event! No Indian had qualified for the 100m final in the history of the University Games before this.
reva_r	1	8	2605	169	19.0	Zebra crossing painted but there's no way to cross in Banjara hills, Hyderabad.
dr137	1	14	2606	49	18.0	Tomorrow is a new day.
lallulal	1	11	2592	79	22.0	Bengaluru traffic cop stops President’s convoy to let ambulance pass; wins hearts and reward too
jasbir_sarna	1	8	2594	119	4.0	Me and the boys going to CP.
meinBhiEngineer	1	14	2589	274	7.0	Cow playing football. Watch till end.
None	1	8	2584	640	16.0	My relatives visited me. And I live with my girlfriend unbeknownst to them. And they lost their shit. And it was a thing of beauty. (Re-posting because violated some rules earlier)
nanavarass	1	8	2582	142	14.0	Kerala tourism advertisement at Times square, New york
seasonofcunts	1	8	2577	177	6.0	Did a Cyberpunk edit on a Paharganj photo I found online.
beginnaki	1	8	2579	109	4.0	Indian Parents be like
Cap-10	1	14	2566	111	17.0	Sunil Chhetri has equalled Lionel Messi with 64 International Goals.
VibgyorHue	1	14	2573	204	20.0	Abuse us, criticise us but please come watch Indian team play: Sunil Chhetri appeals to football fans
ZombieGombie	1	14	2566	81	19.0	These boys in blue have had a fantastic few years too!
codemarauder	1	8	2567	106	20.0	Meanwhile in Gurugram
DvelDeveloper	1	8	2553	249	18.0	Current State of Tamilnadu...
_Spaceman__Spiff__	1	8	2550	128	5.0	[OC] Lightning in Bangalore today
I__Talk__To__Myself	1	2	2541	155	1.0	When you order North Indian food from Swiggy
ribiy	1	11	2523	227	17.0	Beef Ban, Demonitsation, Swacch Bharat and Digital India - Modiji's all the achievements in one frame.
Mycroft-Tarkin	1	8	2524	138	3.0	A month ago a picture of this street in Hyderabad went viral on r/India---here is how it looks now after a cleanup by GHMC
oddLeafNode	1	5	2529	213	20.0	It’s that time of the year everyone !
thelielmao	1	10	2521	243	16.0	You Will Not Decide What One Wants To Watch, You Are A Certification Board Not Censor Board: Bombay HC to CBFC
SnazzyGaz	1	11	2512	98	5.0	Hi r/India, I've been doing some messy, painterly wallpapers of countries' flags, here's yours[1920x1080]
Watdf	1	8	2490	445	5.0	Former President APJ Abdul Kalam passes away
thealbinoturtle	1	11	2480	273	17.0	It's a humble request to you all, please don't share this image. You can go to jail.
babbanbhai	1	11	2458	342	18.0	Right To Privacy is Fundamental Right
GodModeONE	1	8	2456	207	19.0	Endangered crocodile species in Chennai dies due to loud music from a Sheraton hotel event
Brother_Judas	1	11	2429	445	1.0	Empires of India [GIF]
--echoes--	1	8	2421	64	20.0	Because you guys loved the first artwork, here is a second one. Lodhi Art District, Delhi
architect_macha	1	8	2417	62	0.0	Bengaluru police at it with the GOT references! [NP]
nolanfan2	1	14	2415	189	16.0	Meet our nation's future Olympian in shooting. She just blew away Commonwealth Games Record and won Gold by a huge margin of 6.9 points, defeating another shooting veteran Heena Sindhu. And she was born in 2002! just 16yrs old!
iSubhi2012	1	11	2415	101	6.0	When 107-year old 'Mother of Trees' Saalumarada Thimmakka broke protocol & blessed President Ram Nath Kovind while receiving Padma Shri award.She has planted 8000 trees including 400 banyan trees across Karnataka.
Imaginary_Pumpkin	1	11	2408	298	19.0	Deccan Herald does it again.
NewInBangalore	1	9	2403	97	19.0	[OC] Managed to click this magnificent peacock in Kovalam, Kerala - 3024x4032 - iPhone
Abhi3626	1	15	2395	293	6.0	Hunger in Chennai (Madras), India, 1876
wordswithmagic	1	14	2399	122	16.0	Live IPL score on a taxi in Hyderabad
None	1	11	2392	390	19.0	India (1950): 'The Wages of untouchables are wrapped in a leaf and dropped from a safe distance into their hands'.
MisterDecember	1	8	2376	65	4.0	Indian Air Force pilots. 1971 and 2019
Gongoora	1	5	2371	195	3.0	This Thali!
pk1515	1	8	2355	93	18.0	[NP] Wikipedia needs our help.
sumedh0123	1	8	2343	68	20.0	Mumbai police's recent tweet on scams.
loulan	1	8	2348	117	1.0	Shimla
RespectMiAuthorita	1	8	2338	111	17.0	Indian auto drivers during a traffic jam
best_dady	1	8	2334	106	16.0	I saw your Meghalya post and i raise you this boi.... Someplace on the way to Kheerganga, HP.
Ashishtiwari92	1	10	2328	196	14.0	I made 13 illegal toll booth vanish overnight, milking 3-4 lakhs everyday, using RTI
humanefficient	1	8	2321	146	20.0	The 90's is (calcium) strong with this one!
iiiwonderwomaniii	1	11	2323	271	19.0	Deccan Herald's Speak Out: 7th March 2019.
dodunichaar	1	11	2310	369	17.0	When you have more phones than toilets
cetrog	1	14	2314	100	0.0	"Rahul Dravid ""I don't think I can just get a doctorate because I happen to be a famous cricketer, I need to have done something to earn it."" via book Democracy's XI"
veryeasyname	1	9	2300	116	19.0	Mornings at Mulki, India.
reva_r	1	8	2298	203	6.0	LED traffic strip lights in Hyderabad
Coldturkey123	1	8	2292	203	6.0	Tinder scene in India
BetaSweaterPehno	1	8	2287	109	5.0	Father of the year - SCLR Mumbai
Muneerr	1	8	2278	177	18.0	Divided by religion
HypocrisyKiSeema	1	2	2274	220	3.0	Zomato delivery executives at Bawarchi, Hyderabad.
yash3011	1	8	2269	96	3.0	Winter is coming
askquestionsdude	1	15	2261	149	17.0	People don't understand the differences between the army and the paramilitary. BUT THEY MUST.
shhhhhhhhhh	1	8	2256	231	18.0	The whole world is trending #deletefacebook and we're trending this.
browchicawow	1	1	2257	863	15.0	Does my period really makes me impure?
pink_vanilla_skies	1	8	2251	175	18.0	Literally any talent show here.
ektimeye	1	11	2254	201	23.0	Jawaharlal Nehru Meeting Albert Einstein At Princeton, USA, 1949
15percentage	1	8	2252	231	15.0	Youth gathered yesterday in from of Palika Market- Delhi for a silent protest against climate change and to save our mother earth.
worldspy	1	-1	2240	365	2.0	My friend raised a complaint on Urbanclap and CEO replied with this
iphone4Suser	1	8	2238	132	15.0	"[Showerthought] Netflix should provide a ""Skip Song"" Button for Indian movies."
ketchupnomo	1	8	2215	155	7.0	Netflix and other streaming services should have a 'Skip Song' feature (like 'Skip Intro) for Bollywood movies.
slimau5	1	8	2203	156	18.0	"GoT theme song played by ""Arambh"" band using bulbul and dhol tasha in dombivali, India on the occasion of gudi padwa. Thought reddit should see this."
usamasyed	1	11	2199	258	2.0	this new sign just went up at a karachi bakery in hyderabad
naren_93	1	8	2194	97	5.0	Staff from the Election Commission of India returning after conducting a local election in Leh. (Altitude above 10,000 feet)
jurble	1	8	2195	80	0.0	My grandmother, her children, and her sisters in pre-Partition India.
duncsmaps	1	8	2178	143	0.0	I made the Taj Mahal in Far Cry 5!
dob_bindi	1	8	2181	138	9.0	Saw two gentlemen, one with a tray full water glasses and the other with a jug full, get on the bus at a traffic stop. Can't put into words how amazing this small gesture made me feel. [Musheerabad, Hyderabad]
akki95	1	8	2175	86	10.0	This advice is so Indian and relevant, it made me laugh so hard.
reva_r	1	8	2165	115	0.0	I meet these kids everyday when I go on my run. They're always happy.
hhaa101	1	-1	2168	174	21.0	Desperate times calls for desperate measures
kartiksoni2209	1	14	2161	200	18.0	"These Indians in Russia with banner saying ""India coming soon!"""
cybersecp	1	8	2150	164	20.0	'Privileged should try and create a better world': second-richest man in India gives $7.5 billion to his charitable foundation
IINightMasterII	1	8	2149	110	0.0	[NP] We should really appreciate Mumbai Police's social media team.
SanskariNari	1	11	2152	198	23.0	Sushma Swaraj with The King, The Queen and The Prince of Bhutan
wannaflybillu	1	8	2136	78	23.0	I took this image while travelling in the remote villages of Telangana. A man is getting ready to perform in a play while his daughter observes him with all wonder.
None	1	11	2134	189	19.0	#BREAKING - Father of the woman who said that she was raped by a BJP MLA & his accomplices, passed away, allegedly in police custody, after he was arrested yesterday. The woman & her family had attempted suicide outside UP CM Yogi Adityanath’s residence in Lucknow yesterday [P]
Lowcrbnaman	1	9	2133	116	5.0	Goddess Kali drawn on a Starbucks cup by artist Rashmi Krishnappa. [Non OC]
The_DarkMatter	1	8	2131	161	17.0	Life savers!
Dark-Wolverine	1	9	2127	78	6.0	Mural Painting done by my Mom
ghatroad	1	14	2114	99	17.0	Low cost carrom
Brownboypower	1	11	2112	890	20.0	India conducted surgical strikes last night across LoC to safeguard our nation: Defence Ministry
fragilistical	1	13	2108	106	6.0	ISRO's twitter handle just shared this imaged of the GSLV Mk3 launch
CheddarCurtainExile	1	8	2096	181	18.0	Thank you, from a foreigner in Hyderabad
milkstatue	1	2	2089	118	3.0	Zomato being Tomato
h4_hotty	1	8	2088	43	5.0	Lego golden temple
AloneInHimalaya	1	13	2084	139	19.0	God bless India
janzboi	1	8	2072	109	23.0	Hmm
User_Name13	1	11	2071	225	15.0	87 years ago today, Shaheed Bhagat Singh was executed in Lahore, he was 23 years old.
pratyushp276	1	8	2067	92	1.0	[Meme] Every Indian childhood ever.
prasad_knew	1	10	2058	202	18.0	India just approved net neutrality rules that ban ‘any form’ of data discrimination
pagla_kheer_kha	1	15	2061	325	3.0	Reddit meetup 2018 - Kolkata
muneer_lm	1	9	2057	184	17.0	Jodhpur Railway Station. Cleanliness on point. 3120 x 4160, Asus Zenfone Max Pro M1, 13 MP
thelielmao	1	11	2053	135	20.0	Real Priorities of our government [NP]
SnootBoooper	1	8	2057	356	4.0	A guy with a Higher degree than me, delivered my food today.
SouthExchange	1	2	2052	232	0.0	[OC] [Meme] India's massive Jio carrier is blocking VPN sites and violating net neutrality rules
wordswithmagic	1	8	2043	297	20.0	TIL: An Indian will spend one-fifth of this life's earning on a wedding ceremony
Anti_PSycho	1	8	2048	151	18.0	Save Water
humanefficient	1	8	2033	71	21.0	The Mizoram kid, Derek C Lalchhanhima, whose innocent act of taking a chick to hospital went viral yesterday was appreciated at his School St. Pio, Sairang today.
KaranK22	1	8	2037	103	6.0	india's got talent
iqbal002	1	9	2028	129	6.0	Our national pothole is here !
Not_Again_Reddit	1	8	2028	79	7.0	Flipping bottles is too mainstream
TimeVendor	1	8	2028	191	16.0	Help Simran
bnrblr	1	8	2023	78	8.0	Friends back in village have a book club, pic from this Sunday reading under banyan tree.
dr137	1	14	2021	147	4.0	England divides, England unites.
FactCheckPolice	1	8	2004	122	5.0	Religion? Zero fs given by all other animals except us.
askquestionsdude	1	14	2002	79	21.0	This is massive! India wins 368 medals at Special Olympics Summer Games! Kudos!
boredmonk	1	8	1994	162	7.0	[NP] This is Thameem. The Ambulance Driver who drove 518 kms in 6 hours from northern tip of Kerala to the Southern end. The ambulance was taking a 31 day old baby from Pariyaram Medical College (Kannur) to SAT Hospital (Trivandrum). The ambulance reached SAT at 03:15am today morning.
_Floydian	1	8	1991	267	16.0	Whoever invented this should be worshipped as god and saviour of mankind
None	1	8	1990	178	2.0	New Delhi in 1950s. Clean air, without smog.
arunrules87	1	11	1983	167	18.0	Kerala is pulling plastic from the oceans to build roads. Removed 25 tonnes of plastic from the Arabian Sea in first 10 months.
Saigo_Digiart	1	8	1991	163	5.0	A few days ago, I shared the first of my India based comics - Brown Paperbag. The response has been overwhelming. I owe a lot of it to Reddit /r/India. So here are some more of them for those of you who are not on Facebook
