UserId	Category	Flair	Score	NumComments	Hour	Text
shiv4121	2	8	7	1	2.0	Hafiz Saeed Arrested: Here Is What You Need To Know About The 26/11 Mumbai Attack Mastermind
dakotaking	2	8	5	8	2.0	Is just CAT score enough?
ppatra	2	8	9	0	2.0	Veteran Bengali actor Swarup Dutta passes away.
naren_93	2	8	117	13	2.0	This saloon offers all kinds of 'Barbaric' activities
shubham2805	2	8	12	0	2.0	Rapist of 7-year-old girl gets three life terms plus 26 more years in jail
PM_ME_GUD_JOKES	2	11	5	2	2.0	What is the Indian stance on Kalbushan?
MGsquare	2	1	12	6	1.0	Indians who've been to other countries: How would you describe the taste of food at other places like Italy, China, USA, etc. Did you have problems adjusting to their food or was it different but good?
Unhappy_Scale	2	8	9	1	1.0	x Assam floods: Sprinter Hima Das donates half her salary for relief efforts, asks corporates to come forward as well
cookieongo	2	8	7	2	1.0	India's trucks are works of art
Devoid29	2	8	13	14	1.0	can you suggest me some underrated indian movies like tumbbad? it can be of any genre.
RamanySquare	2	8	20	6	1.0	Beginning of my attempt at a Mandala drawing
thelielmao	2	10	11	0	1.0	UK's Eye On Indian Subcontinent Flights As It Tracks Forced Marriages
thelielmao	2	8	1	0	1.0	Women Among 9 Killed In Shootout In UP Village Over Land Dispute
Symmberry	2	8	3	0	1.0	Old Arjun Kapoor to Deepika Padukone, Age Challenge on FaceApp is viral. Best memes
gmyfxd8kpj	2	2	6	1	1.0	Debt mutual funds: Is it time to say goodbye to debt mutual funds?
siasat_daily	2	8	5	0	1.0	One-man collection of brass items that shines like gold - The Siasat Daily
itsmuks	2	11	8	3	1.0	Bill introduced to allow dual citizenship for Indians
rajeevist	2	8	8	0	1.0	‘Copycat’ suicides in SRM Institute: What colleges, families and friends must do
neoronin	2	8	209	18	1.0	Kerala IPS officer Merin goes to Saudi to nab child rape accused, brings him to India
siasat_daily	2	8	7	0	1.0	AIIMS MBBS 2019 Counselling: 540 seats vacant for round 2 - The Siasat Daily
i_Killed_Reddit	2	11	5	1	0.0	Gather info on RSS netas, Nitish Kumar tells Bihar intel
SouthExchange	2	11	39	15	0.0	16 men from Tamil Nadu held, NIA says they were collecting funds for terror attacks in India. While 14 men were deported from UAE and accused of collecting funds for terrorist activities, two others from the state have been accused of being part of the plot.
SouthExchange	2	11	46	9	0.0	Concern over Pakistan using narcotics smuggling to fund terror in India. According to Indian security agencies, Pakistan is using countries in the neighbourhood, particularly Sri Lanka and the Maldives to pump drugs into India.
strngerstruggle	2	1	6	10	0.0	Why should one be fined for not valuing ones own life (Helmets)
kuzan342	2	1	8	8	0.0	Carrer options after 10th ?
sudden_dust	2	11	21	4	0.0	Air purifier!
Indianopolice	2	10	1	1	0.0	IMD: IMD plans timetable tweak to match monsoon reality
thewebdev	2	10	9	3	0.0	RBI Opens its Coffers for Modi Govt; Jalan Panel Suggests Surplus Transfer to Govt over 3-5 Years
self_p_learner	2	1	8	1	0.0	Job application keeps getting rejected because of my education gap years. What are my options?
thelielmao	2	15	33	10	23.0	On Video, Delhi Woman Stopped For Riding Without Helmet Throws A Fit
tonty4	2	13	18	0	23.0	Isro looking at July 21-22 for Chandrayaan-2 re-launch
divansh_mehta11	2	10	9	0	23.0	India building collapse: Rescuers form human chain to search for Mumbai survivors
chattereddit	2	1	16	5	23.0	Travel to Kashmir - Sounds good?
dr137	2	8	12	0	23.0	Forgotten, female, footsoldier: Unearthing the stories of women freedom fighters
ambar_hitman	2	13	12	14	23.0	Redmi K20 Launched Starting at Rs. 21,999, and Redmi K20 Pro Price in India Starts Rs. 27,999
azorahai7	2	10	76	52	22.0	Can the government do something about private companies making their employees work for 9-6:30 instead of the usual 9-5 working?
birbalthegreat	2	1	23	2	22.0	Lawyers looking for a career change. I want to go for interior designing and need to ask some questions!
DrAwesome04	2	1	13	1	22.0	Where can I find the Amended NMC Bill that is going to be proposed in the Cabinet Meeting?
FederalUsual	2	1	4	1	22.0	Looking for plug into switchboard and play Home automation solutions.
moasad	2	1	24	35	22.0	What's Indian youtube scene?
wordswithmagic	2	8	15	15	22.0	Thakor community bans cellphones for unmarried women
WanderlustInCityDust	2	11	6	0	22.0	Hafiz Saeed, the chief of the terror outfit Lashkar-e-Taiba, is considered to be the mastermind behind the 26/11 Mumbai attacks.
tilismilis	2	8	399	22	21.0	After Assam, I did a piece for Bihar too. Please contribute
annihilistvoid	2	11	121	39	21.0	Thakors Ban Inter-Caste Marriages, Mobiles For Girls; Congress MLA Lauds Move
RAD-Business	2	8	11	1	21.0	College Advice
pitchwin	2	11	13	7	21.0	BJP MLA Surendra Singh: ‘Muslim men keep 50 women, have 1,050 kids’
Leathershoe4	2	1	22	16	21.0	Strategy to reduce open defecation in rural communities. How can local government help and incentivize? (And other questions!)
AlekhyaDas	2	11	111	15	20.0	26/11 mastermind Hafiz Saeed arrested from Lahore
nvi14	2	13	31	25	20.0	I know that porn has affected our country a lot but this is just sad
GreatAd8	2	8	34	0	20.0	1.14 lakh people affected as Meghalaya's West Garo Hills district gets flooded
GreatAd8	2	8	62	4	20.0	Telangana boy declared brain dead comes alive amid funeral preparation.
rajeevist	2	11	14	4	20.0	Man held for posting invite for beef festival on Facebook
killer_unkill	2	8	37	12	20.0	TIL Tamil Nadu RTO registration series do not have number which add up to 8.
madamplease	2	8	17	1	20.0	The Sangeet Natak Akademi announces its winners for the year 2018
darmyster	2	8	243	42	20.0	Calling out Instagram Scammers
siasat_daily	2	9	15	2	19.0	India witnesses partial lunar eclipse - The Siasat Daily
josephkiya	2	1	13	12	19.0	What are the current rules of transferring your vehicle to another state?
DesperateEggplant	2	8	60	29	19.0	I think I unscrewed myself [update]
pawarck	2	11	6	5	19.0	Contentious private bill, Should India have 2-child policy? | The Urban Debate with Faye D'souza
SmellsLikeTeenSweat	2	1	19	5	19.0	Can't watch Hotstar Premium videos.
sultanatehere	2	5	12	3	19.0	Have you heard of 'ayurvedic chicken and eggs'? Let Sanjay Raut explain
getuplast	2	11	5	0	19.0	Understanding lynchings: With silent consent for mob violence, society is outsourcing its guilt
sum1spcl	2	1	27	12	19.0	What are the best institutes for Psychology in India?
pewds_is_waifu	2	1	13	15	18.0	I have a canadian prepaid visa gift card any way to cash it in india? Was a student there came back to india now probably wont go yo canada any time soon
sultanatehere	2	11	5	2	18.0	Creeping acquisitions take BJP towards majority in RS
pazhampori	2	11	32	2	18.0	NIA amendments: Amit Shah is wrong – even Advani admitted that POTA was misused
pazhampori	2	15	5	2	18.0	Death by Citizenship: They made it to NRC, but were dropped later – tagged as suspected foreigners
aiyyooooo	2	8	26	0	18.0	Tribal student first from Telangana to get admission into National Sports University. Harilal Ramavath son of a handicapped father and labourer mother, Harilal hails from a tribal hamlet in Nagarkurnool district.
aiyyooooo	2	10	58	10	18.0	Andhra Pradesh decides to put on hold Amaravati expansion works due to lack of funds. The Jagan Mohan Reddy-led government’s white paper on state finances cited a total outstanding debt of Rs 2,58,000 crore. Currently, the govt. is forced to shell out an interest amount of Rs 20,000 crore per month
pazhampori	2	11	12	5	18.0	You May Think You Are an Indian Citizen, but Can You Convince the State?
ilovetechireallydo	2	2	32	29	18.0	Facebook moves closer to launching WhatsApp payment service in India
rprakash1782	2	8	17	3	18.0	Which one of you did this?
sumanthdbz	2	1	44	28	18.0	Career Advice: Is game development a good career choice in India? If not, what are some good fields for a CS student?
pazhampori	2	1	13	6	18.0	What are some Indian music related subreddits?
pammoth	2	8	80	32	18.0	Netflix announces five new Indian shows, including ‘Masaba Masaba’ and ‘Bombay Begums’. Also in the pipeline: the Shah Rukh Khan production ‘Betaal’ and a series about a standup comedian.
pammoth	2	2	35	6	18.0	In terms of room count, OYO is now world's third largest hotel chain
AutoModerator	2	12	13	4	18.0	Monthly food, restaurant recommendation thread - July 17, 2019
AutoModerator	2	12	19	42	18.0	Monthly movies, tv-shows, documentaries, podcasts discussion thread - July 17, 2019
pazhampori	2	11	67	8	17.0	Government and RSS branding dissenters as public enemies: The Caravan’s executive editor to UK and Canada
madamplease	2	11	6	0	17.0	Centre, Assam move SC for sample re-verification of NRC
rig_vedic_sage	2	11	14	1	17.0	Watch: Is there a Rs 1.7 lakh crore gap in the Union Budget?
KooKooKawKaw	2	1	40	16	17.0	"Why does every Oyo hotel I stay at in India bombard me with ""free breakfast?"" calls in the morning?"
pazhampori	2	11	2	1	17.0	Modify syllabus over portrayal of gods, riots: DU academic council
Titi89	2	1	14	0	17.0	Mumbai Sub registrar office- any experiences with agents/ the officers?
pramodc84	2	5	26	9	17.0	Protein and dairy intake may help reduce diabetes risk: study
Froogler	2	11	8	0	17.0	Bombay HC quashes permits for ₹14,000-crore Mumbai coastal road project
oxythebot	2	12	15	272	17.0	Random Daily Discussion Thread - July 17, 2019 at 09:15AM
thisisatypo	2	1	15	31	17.0	"What Indian movie caused you to have a ""WTF did I just watch?"" moment after viewing?"
GlobalCitizen12345	2	8	72	25	17.0	Vistara Flight Lands In Lucknow With Just 10 Minutes Of Fuel Remaining
pramodc84	2	8	64	12	17.0	How India's hydroponic farmers are building businesses | Forbes India
tilismilis	2	8	253	18	16.0	Here's something I designed for Assam! Help Assam by contributing
vidhikaaa	2	1	25	107	16.0	What did you guys have for breakfast? Or what do you usually have for breakfast?
hardshock	2	15	181	4	16.0	Assam floods: Let us stand by our state in these dire times
DiligentCandle	2	15	22	6	16.0	Ranchi court grants bail to student, directs her to distribute copies of Quran
naveen_reloaded	2	1	62	28	16.0	[ASK INDIA] Explain the current Karnataka Political Crisis
STUDBOO	2	1	140	38	16.0	Apply for oracle, they have caste? I mean like wtf why?
sudden_dust	2	8	27	1	16.0	Floods claim 55 lives in Assam and Bihar, red alert sounded in Kerala
Elonq	2	1	8	3	15.0	[Food]Request: Receipes for meals you can cook in a rice cooker
RevolutionRose	2	1	18	3	15.0	MBA at 35
skidd	2	11	241	132	14.0	Ranchi court orders 19-year-old girl to distribute five copies of Quran for sharing communal post on Facebook.
Xoxo2016	2	11	19	6	14.0	In undecided Congress, first open call for Priyanka: She should be party chief
m_hdurina	2	13	3	0	14.0	Isro pinpoints GSLV-MkIII leak to 'nipple joint' of cryo engine
m_hdurina	2	8	11	5	14.0	150% rise in potholes in Mumbai in 10 years
penpractice	2	1	128	74	14.0	"Question for Indians: would you say that the Indian work ethic is similar to the Japanese, where ""appearing to work"" is more important than productivity level?"
trolloindos	2	1	6	0	13.0	Students of Computer Engineering in India, can you share some links of videos that give an idea about what you actually do in your 3 or 4 year course?
krishividya	2	2	80	21	13.0	Looking to replace Chinese imports, US turns to Indian products
koochamonsta	2	2	15	4	13.0	Salaried taxpayers beware! Claiming false HRA, other benefits through ITR may land you in trouble
EveAh9	2	1	5	6	12.0	Tulsi Pan Masala
kratos87	2	1	8	6	12.0	Good laptop under 30000
tradeind27	2	11	20	1	10.0	963 Terrorists, 413 Security Personnel Killed in J&K Since 2014
username-_--	2	1	2	11	10.0	IIT jee exam.
meenakshi1995	2	11	3	0	10.0	Are the Executive and Judiciary really separate in India?
Gavthi_Batman	2	9	48	2	9.0	Partial Lunar eclipse seen all around India at 1:51 AM.
CShahin	2	8	7	0	9.0	Ten dead in Mumbai building collapse
FederalUsual	2	1	3	1	9.0	Looking for plug into switchboard and play Home automation solutions.
mortandrickyYY	2	1	3	3	8.0	Doing a masters in law abroad
mint_lips	2	8	69	6	8.0	We need more of this !
WANDERLS7	2	1	5	26	8.0	Need a new phone under 27K.
SumoneSumwere	2	1	8	2	8.0	Career Advice. B.E. comp engg. Its been 2 yrs haven't taken any job. Thinking of MBA.
ibilovesass	2	1	4	14	8.0	Trekking or biking
dalaihdev	2	2	7	3	8.0	Multiple UPI ids
SiddharthDot	2	13	6	6	8.0	Laptop for College student
depressinister	2	13	7	3	8.0	Custom Firmware on Jio GigaFiber Router
bs_dhani	2	8	9	3	7.0	My Room Room door has this engraved wording. - iPhone (750x1340)
madamplease	2	10	14	1	7.0	After Cox & Kings and DHFL, Suzlon defaults on bond payments of $172 million
shaansmwl77	2	8	14	11	7.0	As a 2nd Year CSE Student from a tier 3 college, what technologies / languages should I be well versed with with respect to the upcoming semesters ( 3rd, 4th, 5th and so on and on ) as to secure internships and ultimately a on / off campus job
transposd	2	1	1	0	7.0	Best hospital in Delhi for cancer treatment.
fuckyallmat	2	8	2	14	7.0	Kabir Singh - Why I dont watch Bollywood movies?
scribbbblr	2	8	192	44	7.0	Snake Bites Man in Gujarat, Man Bites it Back, Both Die
firedtoday098	2	1	14	11	7.0	Career advice needed: What the fuck is this?
MelodicBerries	2	15	7	0	7.0	Sakshi Mishra did not run away only for love – but also to escape discrimination at home
fragment_transaction	2	8	29	19	7.0	[Showerthought] What was the lag when Sanjay was narrating Mahabharat live to Dhritrashtra?
Minuteman60	2	8	48	66	7.0	Lifecycle of Indian Male
indiamodrgandu	2	8	5	1	6.0	My colleague's incompetence is killing me
Nokse22	2	1	25	25	6.0	Can someone explain me why so many people ask me (tourist) for selfies?
wordswithmagic	2	8	40	0	6.0	43 Lakh Affected, 95% Of Kaziranga Park Flooded In Assam
_vargs_	2	10	10	1	6.0	India’s shooting for the Moon, and the country is pumped
tardyman	2	1	6	2	6.0	About Psylocibin and other psychedelics in general
96krishna	2	8	5	9	6.0	Someone please help me with the mobile choice( Samsung M40 or wait for Redmi K20).
zpw6hgtmx3	2	11	1	2	5.0	sebi: Govt may have bigger say in Sebi finances
peanutbutterasteroid	2	-1	61	5	5.0	Dear r/India, let’s help 11 year old Naveen beat his liver illness
nikkeiasianreview	2	11	9	0	5.0	International court to rule on India-Pakistan spy drama
ilovetechireallydo	2	13	9	0	5.0	Exclusive: MeitY to finalise Intermediary Liability rules amendment by month end
ssj_cule	2	12	23	908	5.0	Late Night Random Discussion Thread !
tilismilis	2	14	312	14	5.0	Hima Das donates half of salary for Assam flood relief, appeals for help
bathlaaman	2	1	17	15	4.0	Vagabonding in Mumbai
RevenantPanda	2	14	13	0	4.0	Buoyed by Junior Championships title, Veer Chotrani out to scale greater heights
sumedh0123	2	5	384	51	4.0	Don't you love it. The 10% extra
MautKeBaadAishHai	2	9	256	12	4.0	[OC] Ominous. Shot on Canon SX500, 3456x4608. Processed in Lightroom
njaanthanne	2	8	22	14	4.0	Moving to new place, Looking for life hacks to live frugally
Ranjeettherapist	2	1	29	15	4.0	I took double the time it should take to complete engineering. What should I even mention on my resumes and bio's especially on sites like Linked In?
aiyyooooo	2	8	172	7	4.0	Kerala students get show cause notice for exposing medical college malpractices. The students said that the college lacks medical equipment and electricity, and claimed that ‘fake patients’ were brought to the hospital.
aiyyooooo	2	8	44	2	4.0	Telangana's First Organic Village Is Leading The Way In Natural Farming. Around 13 years ago, all 52 families in the village shifted to natural farming, without using pesticides or chemicals.
throwaaway14342169	2	1	61	36	4.0	What's wrong with Indian parents?
OrneryReflection	2	14	1745	74	3.0	The critics try to pull me down but I'm too busy out running them.
TheUnfaithfulUser	2	1	50	67	3.0	Never boarded a plane before. Do they allow using phones while in air?
sudden_dust	2	11	51	0	3.0	Karnataka Trust Vote
GreatnessX	2	1	13	11	3.0	Need to assemble a machine for video editing under 90k, please help me with specs!
nastynash2k	2	1	7	4	3.0	Change name in CBSE 10th marksheet
MrAvidReader	2	8	44	22	3.0	A very interesting place where four Indian states ( UP, Uttarakhand, Himachal Pradesh and Haryana Meet) Border porn
madamplease	2	10	1	1	2.0	Deutsche Sees India Yields Drop to Lowest Since Global Crisis
centre_punch	2	1	2	0	2.0	Career advice for an ECE undergrad.
ISeeCrabPeople	2	1	8	12	2.0	[Help] I need to transfer money from Europe to India.
s18m	2	8	4	0	2.0	Bombay high court allows PIL against Coastal Road; says environmental clearance is required
BlueFrenchHornThief	2	1	9	5	1.0	Suggestions for a small weekend trip
viksi	2	10	4	0	1.0	June exports slip 9.7% on fall in petroleum products, rice, gems and jewellery shipments
Talldarkn67	2	11	1	13	1.0	"Is India really ""The New China""? Is that a ""good"" thing?"
mswebsitemaster	2	14	26	1	1.0	BCCI Invites Applications For India Coach, Support Staff,
clorox02	2	1	8	4	1.0	What are my options to study abroad?
Yisdrumgone	2	1	11	2	1.0	What do you guys suggest?
cleanstart92	2	15	35	33	0.0	A <insert adjective> analysis of 'Hindu khatre mein hain!'
BarLaws	2	8	11	0	0.0	Suspected JeM terrorist arrested
icicibank	2	14	22	2	0.0	Against the odds - Shankar Sajjan | Sportskeeda
BarLaws	2	8	18	1	0.0	NIA arrests 14 Tamil Nadu men deported from UAE | Chennai News - Times of India
IAmTheFlash9	2	8	291	152	0.0	Unpopular Opinion: Children shouldn't be forced by their parents to touch the feet of their elders as a custom.
Symmberry	2	8	12	3	0.0	Rare Rhinos In Kaziranga National Park In Danger As Assam Floods Worsen
ch3nr3z1g	2	8	8	0	0.0	Are there stations or playlists on Jiosaavn that have only instrumental songs? (no vocals) I looked and didn't find any. Thanks, If there are some good instrumental only stations on Jiosaavn, I'll purchase the Pro version.
DeadRootsStirring	2	8	9	1	23.0	How to Grow a Forest Really Really Fast | Miyawaki Afforestation Project of Kerala Tourism
Oxeam3	2	1	27	70	23.0	People who studied engineering what you are doing now and how's is life?
lh261144	2	1	7	13	23.0	What are some good charity to donate to?
prisonmike_11	2	1	33	21	23.0	People who studied engineering and decided it's not for you, what are you doing now and how's life?
DoorFeko	2	1	1	0	23.0	[Help] Need to transfer money from Europe to India.How do I do that?
testesaurus	2	1	6	12	23.0	A startup revoked my offer letter, what can I do now?
whatever6999	2	8	1	0	23.0	"AskHistorians question - ""When and where did the Hindu caste system originate""?"
Unhappy_Scale	2	8	176	31	23.0	Assam Is Drowning But No One Cares
capj23	2	1	20	9	22.0	Is dowry the woman's inheritance from her family? Or are those two different things?
7xbvt	2	10	56	2	22.0	Government to set up 1023 fast track courts to clear pending rape, POCSO cases. According to government data, at least 90,000 cases related to sexual offences against children were pending trial till 2016. The fast track court aims to clear the back log.
7xbvt	2	10	115	16	22.0	4 child-rape cases every day, situation grim: Supreme Court
mrdrinksonme	2	8	228	34	22.0	Delhi HC Imposes ₹50,000 Cost On Woman For False Sexual Harassment Plea
to_day	2	8	54	2	22.0	Forty years after retirement, IAF man donates over Rs 1 cr to defence ministry | India News - Times of India
7xbvt	2	10	38	4	22.0	Supreme court takes suo motu cognizance of ‘alarming rise’ in child rape cases. | A bench of Chief Justice of India Ranjan Gogoi and Justices Deepak Gupta and Aniruddha Bose said that between January 1 and June 30 this year, a total of 24,212 FIRs related to child rapes were filed across the country
vectrum	2	10	3	4	22.0	Budget: The joke's on the middle class
Kshatriya71	2	1	7	44	22.0	If given a choice where would you have preferred to be born?
pramodc84	2	10	2	0	21.0	High Court quashes CRZ clearance to ₹ 14,000-cr Mumbai road project
GL4389	2	1	32	12	21.0	People who moved into a township with gym, theater etc. all contained in it, what has been your experience with the township ?
Cursive172	2	1	8	4	21.0	Hotstar outside India
lolwhyry	2	1	8	2	21.0	Is it necessary to have a mentor for CAT or any other competitive exam preparation?
lineforce	2	15	104	29	21.0	IIT Student Who Died By Suicide Wrote A Searing Take On Indian Politics
dheerajdeekay	2	11	8	0	21.0	People will choose successor: Lalu Prasad
charavaka	2	11	50	30	21.0	After bull run, IIT-Bombay plans gaushala on campus | Mumbai News - Times of India
siasat_daily	2	8	46	11	21.0	UPSC topper Ira Singhal trolled on Instagram - The Siasat Daily
skinsaremylife	2	8	63	14	20.0	Four-storey building collapses in Mumbai’s Dongri, over 40 feared trapped
whiteblackgray	2	1	9	1	20.0	which ITR form to fill?
Pratik5211	2	1	11	2	20.0	Please Help
ILoveGuaco	2	1	119	160	20.0	Are men in India willing to date/marry a single mom?
shr612	2	8	142	13	20.0	Gujarat: 959 students, same answers, same mistakes [NP]
pammoth	2	8	109	49	20.0	Actress Sridevi's death 'may not be accidental', supercop Rishiraj Singh cites forensic expert. Rishiraj Singh says a forensic expert told him that though a person is heavily drunk, he or she would not drown in just one-feet water.
courtysim	2	8	225	37	20.0	Soon, Rs 10,000 fine for blocking an ambulance, Rs 5,000 for no licence
m0rtalReminder	2	1	20	11	20.0	Ola Pass a scam?
GL4389	2	8	15	21	20.0	Mumbai: Father kills 20-year-old pregnant daughter for marrying against his wishes
thundertwonk50	2	8	144	12	20.0	Please help me get my friend back to India.
zetret	2	1	22	9	20.0	How to obtain a single/unmarried certificate in India?
network127	2	1	3	1	20.0	Wooden countertop for electric desk?
sidcool1234	2	1	19	7	19.0	[AskIndia] - How do you start retirement planning
MainBuilder	2	10	18	0	19.0	Pakistan opens airspace for all civilian traffic; Indian flights to operate soon.
streanh	2	11	2	5	19.0	Hindi has lowered debate standards in Parliament: Vaiko
HopefulWind	2	8	8	6	19.0	Hey Randia, Can you review/critique my short story?
ainy_jaffri	2	1	26	36	19.0	[Question] That *schick* sound people make with their mouths ... WHAT'S IT CALLED?
pammoth	2	8	20	7	19.0	A growing number of people are finding love, soulmates and life partners on social media. But this is a love story with an unusual twist. A Danish woman travelled over 6,000 kilometres to marry a drug addict from India, who she met on the internet in January 2019.
meinBhiEngineer	2	8	210	31	19.0	Man survives in sea for 5 days by holding onto a bamboo pole
rudraxa	2	11	117	29	19.0	Pakistan has fully reopened its airspace to civilian flights, nearly five months after it was closed during a dispute with India
OrneryReflection	2	10	123	18	18.0	No My Lord, Your Lordship — Rajasthan HC asks lawyers to junk colonial-era honorifics. The decision was taken unanimously at a full-court meeting of the Rajasthan High Court.
i_am_siddharth	2	1	37	26	18.0	I am going to persue mechanical engineering. The internet scared the shit out of me!! I need some advice.
w5uhkyermx	2	2	23	1	18.0	Non-bank finance companies freeze hiring
seppukuAsPerKeikaku	2	1	29	12	18.0	Will it be a problem if I carry 3 laptops on a domestic flight?
w5uhkyermx	2	2	24	14	18.0	DHFL: DHFL shares plummet 30% on fear of collapse
aiyyooooo	2	10	119	16	18.0	38-yr-old woman dies during fight over water at public tap in Andhra Pradesh. Quoting eyewitnesses, the police said trouble started when some women broke the queue at the tap.
aiyyooooo	2	8	25	2	18.0	Jailed Sarvana Bhawan owner P Rajagopal suffers heart attack, son moves court for treatment at private hospital.
bellyflop2	2	8	9	6	17.0	How to purchase something from Jaisalmer to US?
zeusdreaming	2	15	24	27	17.0	Please help. How do I get over my fear of swallowing pills?
MuhMeLekeNaach	2	8	124	55	17.0	PSA: Change region in your Xiaomi phone to any country in Europe to get rid of all the bloatware.
oxythebot	2	12	23	74	17.0	Random Daily Discussion Thread - July 16, 2019 at 09:15AM
sultanatehere	2	1	19	12	16.0	Where can I find population census data of past years?
ignisxicor	2	8	59	23	16.0	Definition of jugad
shriphani	2	1	17	68	16.0	What do most of the folks here do for a living?
ParagPa	2	1	14	3	16.0	Old Doordarshan commercial set to Uptown Girl?
waahmudijiwaah	2	15	437	144	15.0	[LPT] Amazon/Flipkart sale: Its never a good deal if you were not going to buy that item in the first place
waahmudijiwaah	2	8	27	3	14.0	Maharashtra: Man pushes wife to death at pilgrimage site after 'tiff'
gccmelb	2	8	23	8	14.0	Lawyer for Indian hit-run driver hopes for Australia deal 11 years after death
vortexxx192	2	1	2	2	13.0	India's meme culture
A27_97	2	10	43	15	13.0	AICTE not to allow low employment potential disciplines from 2020-21: HRD Minister
11ej25	2	8	61	31	13.0	PSA: Ancestors from Goa? You may be eligible for Portuguese citizenship by descent (EU)
spaceraingame	2	8	8	12	12.0	Government workers of India, what do you love and hate most about your job?
MemoryDealers	2	10	5	4	12.0	Despite a potential 10 year jail sentence, people are buying and selling Bitcoin Cash in India using Bitcoin.com's encrypted platform.
throwawaytraveller9	2	1	3	1	11.0	Need some help with luggage storage
FinalMachiavelli	2	1	4	2	11.0	Need some advice and tips on safety
lmkagarwal	2	8	10	1	10.0	17,528 rape cases reported in Odisha in 10 years: Minister
MelodicBerries	2	15	16	2	9.0	India’s Terrifying Water Crisis
packy21	2	1	10	5	9.0	Where can i buy a Shehnai (at a reasonable price) ?
morlock77	2	1	17	2	8.0	Guys do you recommend books by Audrey Truschke? If yes tell me which.
BirdelDander	2	1	2	2	8.0	How can i pay by cryptocurrency in Indian Hotel at 3.00 am?
azi212	2	11	11	1	8.0	Hyderabad police detain Mojo TV's Revathi Pogadadanda
skakat456	2	11	5	1	8.0	As a non-indian I wanted to know is India improving under Narendra modi? Is the economy getting better?
cvrjk	2	1	12	18	8.0	Is there anything in India that'll give you a quality of life at least somewhat near to those doing an MS in US and working there?
_Floydian	2	1	11	1	8.0	Update of Spotify case with Warner?
